Auto_Date,Auto_Time,Form_No,Entry_Personnel,Filled_Date,FIR_No,Police_Station,Time_Of_Crash,Date_Of_Crash,Collision_Type,Hit_and_Run,Special_Case,Case File Available,Crash_Severity,No_Of_ Fatalities,No_Of_ Injured,No_Of_Vehicles,Location,Road_Type,Road_1,Road_2,Road_3,GPS_Lat,GPS_Long,Note,No_of_Lanes,Curb_Type,Shoulder_Type,Median_Type,Light_Condition,Weather_Condition,Crash_ID,Distance_From_Landmark,Text97,Veh_Rel_Travel_Dir
12-09-2022,08:45 AM,210071,Ashwani,09-May-22,0071,111,10:30,03-04-2021,Unknown,FALSE,FALSE,FALSE,Fatal Crash,1,0,2,Unknown,,Near Gujjar Bhawan,"Dallupura , Delhi",,29,77,One scooty and bus collided which resulted in injuries to scooty rider . He was taken to hospital by CATS ambulance and later died during treatment .,,,,,,,3605,0,WEST,Unknown
12-09-2022,08:45 AM,210198,Ashwani,09-May-22,0198,111,20:30,08-06-2021,Single Vehicle Hit Fixed Object,FALSE,FALSE,FALSE,Fatal Crash,2,0,1,Unknown,,Under New Ashok Nagar,Metro Station,,29,77,"One motorcycle hit the wall of drainage nala, the rider and pillion fell into it and drowned . Both were taken out by help of NDRF team and sent to hospital in CATS ambulance where they were declared DOA.",,,,,,,3606,2,South,Not Applicable
12-09-2022,08:45 AM,210241,Ashwani,10-May-22,0241,111,00:30,27-06-2021,Unknown,TRUE,FALSE,FALSE,Fatal Crash,1,1,2,Unknown,,Kondli Pul Red Light,,,29,77,A rider and pillion rider of bike were hit by truck and were taken to hospital by PCR.,,,,,,,3607,2,East,Unknown
12-09-2022,08:45 AM,210417,Ashwani,10-May-22,0417,111,02:32,11-09-2021,Hit Pedestrian,TRUE,FALSE,FALSE,Fatal Crash,1,0,1,Unknown,,Dallupura Mod,Delhi,,29,77,One pedestrian was hit by unknown vehicle and there are no details available about the victim also .,,,,,,,3608,0,,Unknown
12-09-2022,08:45 AM,210287,Ashwani,10-May-22,0287,109,08:46,26-08-2021,Unknown,TRUE,FALSE,FALSE,Fatal Crash,1,0,2,Unknown,,New Modi Mill Flyover,Towards Sarita Vihar to Ashram Chowk,"Mathura Road , Delhi",29,77,"A rickshaw puller was hit by unknown vehicle , the rickshaw puller died on the spot due to impact.",,,,,,,3609,1,,Unknown
12-09-2022,08:45 AM,210298,Ashwani,10-May-22,0298,109,00:26,12-09-2021,Hit Pedestrian,TRUE,FALSE,FALSE,Fatal Crash,1,0,1,Unknown,,"Mathura Road ,","Near Kalka Mor Bus Stop,",NFC,29,77,"One pedestrian was found unconsious on road , when taken to hospital was declared DOA.No details of offending vehicle available in FIR.",,,,,,,3610,0,west,Unknown
12-09-2022,08:45 AM,210341,Ashwani,10-May-22,0341,109,12:15,17-10-2021,Backend Collision,FALSE,FALSE,FALSE,Fatal Crash,1,0,2,Unknown,,Modi mill Flyover,"NFC , New Delhi",,29,77,"Scooty was hit by car from behind , this resulted in fall of driver and pillion rider of scooty. Pillion rider was injured and talen to hospital in offending vehicle itself by owner of car .Upon arrival of hospital doctor declared victim DOA .",,,,,,,3611,1,,Same Direction
12-09-2022,08:45 AM,210353,Ashwani,10-May-22,0353,109,19:30,24-10-2021,Hit Pedestrian,TRUE,FALSE,FALSE,Fatal Crash,1,0,1,Unknown,,Near Barat Ghar,Sarai Julena,,29,77,"A pedestrian was hit by Gramin sewa , the victim was rushed to hospital by public and admited .",,,,,,,3612,2,,Unknown
12-09-2022,08:45 AM,210406,Ashwani,10-May-22,0406,109,00:30,24-12-2021,Hit Pedestrian,FALSE,FALSE,FALSE,Fatal Crash,1,0,1,Unknown,,Sukhdev Vihar Bus Depot,Modi Mill flyover,,29,77,One pedestrian was hit by truck from behind and the victim died on the spot as the truck's rear wheel ran over the head of  pedestrian .,,,,,,,3613,1,,Same Direction
12-09-2022,08:45 AM,210421,Ashwani,10-May-22,0421,109,14:00,04-12-2021,Hit Pedestrian,TRUE,FALSE,FALSE,Fatal Crash,1,0,1,Unknown,,Mathura Road,Near CNG Pump,,28,77,One pedestrian was found unconscious on road when taken to hospital by police was declared DOA by doctor .,,,,,,,3614,0,,Unknown
12-09-2022,08:45 AM,210146,Ashwani,10-May-22,0146,110,11:30,26-03-2021,Hit Pedestrian,FALSE,FALSE,FALSE,Fatal Crash,1,0,1,Unknown,,Near MCD Flats,"Usmanpur , Delhi",,29,77,A lady pedestrian was hit by unknown vehicle and brought to hospital by family . She died in hospital during treatment .,,,,,,,3615,0,,Unknown
12-09-2022,08:45 AM,210419,Ashwani,10-May-22,0419,110,21:00,04-07-2021,Hit Pedestrian,TRUE,FALSE,FALSE,Fatal Crash,1,0,1,Unknown,,MCD Flats New Usmanpur,,,29,77,A pedestrian was hit by a car (details unknown) and taken to hospital by ralatives . He was under treatment for about 27 days and died during treatment.,,,,,,,3616,1,North,Unknown
12-09-2022,08:45 AM,210010,Ashwani,10-May-22,0010,112,09:30,04-01-2021,Unknown,TRUE,FALSE,FALSE,Fatal Crash,1,0,,Unknown,,"Khanda Chowk , near Nala","Dawai Godam , Chander Vihar",Delhi,29,77,One Motorcyclist was found unconscious on road and take to hospital by public in car . He was declared DOA in hospital . There were no details available/ eyewitness of crash .,,,,,,,3617,2,South East,Unknown
12-09-2022,08:45 AM,211159,Ashwani,10-May-22,1159,112,00:56,26-09-2021,Backend Collision,TRUE,FALSE,FALSE,Fatal Crash,1,0,2,Unknown,,Near Importy Shopping Mart,Janta Dharam Kanta,Najafgarh Main Road,29,77,"A motorcyclist was hit by a dumper truck .After hitting the rider the truck ran over him , killing the rider on the spot.",,,,,,,3618,1,North,Same Direction
12-09-2022,08:45 AM,211443,Ashwani,10-May-22,1443,112,18:57,28-12-2021,Sideswipe (Same Direction),TRUE,FALSE,FALSE,Fatal Crash,1,,2,Unknown,,"Near Hanuman Mandir 
Near Hanuman Mandir",Nangloi Najafgarh Road,,29,77,A scooty was hit from sideways by mini bus . Due to impact the driver of scooty fell away from it and the pillion rider fell in towards the bus and ran over her head . Killing the pillion rider on the spot .,,,,,,,3619,1,North,Same Direction
12-09-2022,08:45 AM,210005,Ashwani,10-May-22,0005,113,21:25,18-01-2021,Hit Pedestrian,TRUE,FALSE,FALSE,Fatal Crash,1,0,1,Unknown,,"Gate no 4 , RML Hospital","BKS Marg , New Delhi",,29,77,A pedestrian was hit by unknown vehicle and taken to hospital by ambulance .,,,,,,,3620,1,North East,Unknown
12-09-2022,08:45 AM,210022,Ashwani,10-May-22,0022,113,16:30,03-04-2021,Backend Collision,FALSE,FALSE,FALSE,Fatal Crash,1,0,2,Unknown,,"BKS Marg, Gate no 3",RML Hospital,New Delhi,29,77,"A Motorcyclist was hit from behind by a car . This led to fall of both rider and pillion rider from motorcycle , injuring the pillion rider.",,,,,,,3621,1,North East,Same Direction
12-09-2022,08:45 AM,210058,Ashwani,10-May-22,0058,113,00:40,17-07-2021,Unknown,FALSE,FALSE,FALSE,Fatal Crash,1,0,1,Unknown,,"Gate no 5 , BKS Marg","RML Hospital, New Delhi",,29,77,A lady was hit by unknown vehicle and admited to hospital by ambulance driver . No other details available of incident and victim .,,,,,,,3622,1,North East,Unknown
12-09-2022,08:45 AM,210060,Ashwani,10-May-22,0060,113,00:15,28-07-2021,Hit Pedestrian,TRUE,FALSE,FALSE,Fatal Crash,2,0,1,Unknown,,"Gate no 4 , RML Hospital","BKS MARG , DELHI",,29,77,02 pedestrians were hit by a car and taken to hospital .,,,,,,,3623,1,North,Unknown
12-09-2022,08:45 AM,210068,Ashwani,10-May-22,0068,115,10:00,03-02-2021,Hit Pedestrian,TRUE,FALSE,FALSE,Fatal Crash,1,0,1,Unknown,,Near Crown Plaza Hotel,"Okhla Phase 1 , New Delhi",,29,77,one pedestrian was hit by auto on road . The auto fled the scene and no other details available of it .,,,,,,,3624,0,North,Unknown
12-09-2022,08:45 AM,210095,Ashwani,10-May-22,0095,115,06:00,22-02-2021,Backend Collision,FALSE,FALSE,FALSE,Fatal Crash,1,0,2,Unknown,,Maa Anandmai Marg,"Okhla Indus. Area , Phase 1",New Delhi,29,77,One cycle rickshaw puller was hit from behind by a scooty due to this he sustained injuries . No details of scooty are available .,,,,,,,3625,0,South,Same Direction
12-09-2022,08:45 AM,210104,Ashwani,10-May-22,0104,115,10:45,07-03-2021,Hit Pedestrian,FALSE,FALSE,FALSE,Fatal Crash,1,0,1,Unknown,,"Near D-68 , Okhla Indus. Area","Phase 1, New Delhi",,29,77,One pedestrian girl was hit and run over by tempo.She died on the spot .,,,,,,,3626,2,South East,Unknown
12-09-2022,08:45 AM,210105,Ashwani,10-May-22,0105,115,22:20,07-03-2021,Unknown,TRUE,FALSE,FALSE,Fatal Crash,1,1,2,Unknown,,Near Ford Showroom,"Okhla Phase 1, New Delhi",,29,77,One motorcycle was found in accidental condition and the rider and pillion rider were injured and taken to hospital by ambulance .,,,,,,,3627,1,south East,Unknown
12-09-2022,08:45 AM,210162,Ashwani,11-May-22,0162,115,08:40,26-03-2021,Backend Collision,FALSE,FALSE,FALSE,Fatal Crash,1,0,2,Unknown,,"Anand Mai Marg,",Towards Kalkaji Mandir,"Okhla Indus. Area ph-1 , Delhi",29,77,"One bicycle  rider was hit by car from behind , this led to injuries to him . He was taken to hospital by the offending vehicle .",,,,,,,3628,2,South,Same Direction
12-09-2022,08:45 AM,210564,Ashwani,11-May-22,"0564
0564",115,11:00,19-07-2021,Unknown,TRUE,FALSE,FALSE,Fatal Crash,1,0,2,Unknown,,"Canara Bank , Okhla Estate Road","Okhla Phase -1 ,",New Delhi,29,77,A motorcyclist was hit by unknown vehicle and victim was taken to hopspital by relative . Where he was declared DOA .,,,,,,,3629,0,North,Unknown
12-09-2022,08:45 AM,210668,Ashwani,11-May-22,0668,115,16:00,03-09-2021,Backend Collision,FALSE,FALSE,FALSE,Fatal Crash,1,0,1,Unknown,,"Company no S-101 ,",Okhla Indus. Area Phase -2,New Delhi,29,77,A car driver while reversing the car  hit a child and ran over her . When the child was taken to hospital in the offending vehicle she was declared DOA by doctor .,,,,,,,3630,1,North East,Opposite Direction
12-09-2022,08:45 AM,210803,Ashwani,11-May-22,0803,115,07:13,30-10-2021,Unknown,FALSE,FALSE,FALSE,Fatal Crash,1,0,2,Unknown,,Near  Crown Plaza,"Red Light , Okhla Indus. Area",New Delhi,29,77,A motorcyclist was hit by truck and causing injuries to the rider .The Injured was taken to hospital by PCR van where he was declared DOA .,,,,,,,3631,0,North,Unknown
12-09-2022,08:45 AM,210383,Ashwani,11-May-22,0383,118,00:00,24-09-2021,Hit Pedestrian,TRUE,FALSE,FALSE,Fatal Crash,1,0,1,Unknown,,Near Gali no 15,Sadar Thana Road Motiya Khan,Paharganj Delhi,29,77,One pedestrian was found injured on rad and taken to hospital by PCR van . No other details of offending vehicle and eyewitness available.,,,,,,,3632,1,North,Unknown
12-09-2022,08:45 AM,210452,Ashwani,11-May-22,0452,117,01:30,23-11-2021,Single Vehicle Hit Fixed Object,FALSE,FALSE,FALSE,Fatal Crash,1,0,1,Unknown,,"Hno WZ 23, Nasirpur,",Harijan Basti,Delhi,29,77,One car crashed into the staircase of house this impact resulted in death of driver . He was taken to hospital by CATS ambulance and declared DOA .,,,,,,,3633,1,North,Opposite Direction
12-09-2022,08:45 AM,210009,Ashwani,11-May-22,0009,119,10:00,04-01-2021,Unknown,FALSE,FALSE,FALSE,Fatal Crash,1,0,1,Unknown,,"NH-9 , Khel Gaon Flyover",,,29,77,An auto driver was brought to hospital in ambulance as he was injured due to fall from the auto.,,,,,,,3634,3,west,Unknown
12-09-2022,08:45 AM,210274,Ashwani,11-May-22,0274,119,21:30,02-06-2021,Unknown,TRUE,FALSE,FALSE,Fatal Crash,1,0,2,Unknown,,"NH-24 , Near Akshardham Temple",Towards Sarai Kale khan,Delhi,29,77,"A motorcyclist was hit by an unknown vehicle , causing injuries to him .",,,,,,,3635,2,West,Unknown
12-09-2022,08:45 AM,210637,Ashwani,11-May-22,0637,119,00:00,29-10-2021,Unknown,TRUE,FALSE,FALSE,Fatal Crash,2,0,2,Unknown,,Nh-24 Towards Sarai kale khan,Akshardham Bus stand,Delhi,29,77,"One motorcycle was hit by unknown vehicle, injurying both the rider and the pillion .The were taken to hospital by ambulance where they were declared dead .",,,,,,,3636,2,East,Unknown
12-09-2022,08:45 AM,210662,Ashwani,11-May-22,0662,119,15:15,06-11-2021,Backend Collision,FALSE,FALSE,FALSE,Fatal Crash,1,4,2,Unknown,,"Nh -24 , opposite Akshardham temple",,,29,77,one auto crashed into a parked truck . This collision led to injurying 01 driver and 04 passengers.,,,,,,,3637,3,East,Same Direction
12-09-2022,08:45 AM,210667,Ashwani,11-May-22,0667,119,10:45,08-11-2021,Backend Collision,FALSE,FALSE,FALSE,Fatal Crash,1,1,2,Unknown,,"Main Kotla Road , near ITI",Khichripur MV IST,,29,77,"One DTC bus hits motorcycle from behind , this results in injury of bike rider and death of pillion on the spot .",,,,,,,3638,3,South west,Same Direction
12-09-2022,08:45 AM,210024,Ashwani,11-May-22,0024,119,04:00,10-01-2021,Unknown,TRUE,FALSE,FALSE,Fatal Crash,1,0,2,Unknown,,"Auto Stand , Kotla Village",Delhi,,29,77,One Auto driver (goods) had disemarked his vehicle when a car hit . He was take to hospital for treatment.,,,,,,,3639,3,South,Unknown
12-09-2022,08:45 AM,210301,Ashwani,11-May-22,0301,119,,27-06-2021,Unknown,FALSE,FALSE,FALSE,Fatal Crash,1,0,1,Unknown,,"Main road PPG,",Near Shashi Garden Mor,Delhi,29,77,A truck had hit one pedestrian causing injuries to him. The pedestrian was taken to hospital by CATS ambulance .,,,,,,,3640,2,East,Unknown
12-09-2022,08:45 AM,210550,Ashwani,11-May-22,0550,119,18:17,25-09-2021,Unknown,TRUE,FALSE,FALSE,Fatal Crash,1,0,2,Unknown,,Akshardham Flyover,Towards Noida,Delhi,29,77,One Motorcycle rider was found in injured condition along with a bike . He was hit by unknown vehicle .,,,,,,,3641,2,West,Unknown
12-09-2022,08:45 AM,210018,Ashwani,11-May-22,0018,123,12:05,17-01-2021,Head on Collision,FALSE,FALSE,FALSE,Fatal Crash,1,0,1,Unknown,,"Outer ring Road , Peeragarhi Chowk",Red Light Signal,,29,77,A speeding truck had hit a pedestrian killing him on the spot .,,,,,,,3642,2,North West,Opposite Direction
12-09-2022,08:45 AM,210463,Ashwani,11-May-22,0463,123,20:35,22-06-2021,Unknown,TRUE,FALSE,FALSE,Fatal Crash,1,0,2,Unknown,,Near Paschim Vihar Metro station,A-5B Shanti Kunj Gate no 6,Paschim Vihar Delhi,29,77,One E Rickshaw had hit motorcylce rider . This resulted in injury to bike rider and when taen to hospital by relative was declared dead.,,,,,,,3643,2,North East,Unknown
12-09-2022,08:45 AM,210500,Ashwani,11-May-22,0500,123,21:00,03-07-2021,Hit Pedestrian,FALSE,FALSE,FALSE,Fatal Crash,1,0,1,Unknown,,"Dairy wala Bagh,","Raksha Kunj, Paschim Vihar",,29,77,a pedestrian was hit by car and injured . The victim was taken to hospital by friend .,,,,,,,3644,2,South East,Unknown
12-09-2022,08:45 AM,210522,Ashwani,11-May-22,0522,123,16:30,10-07-2021,Hit Pedestrian,FALSE,FALSE,FALSE,Fatal Crash,1,0,2,Unknown,,Maj. Ashwani Kanav Marg,Opp. GD Goenka School,Paschim Vihar,29,77,"A pedestrian was hit by a car , this resulted in injuries to the lady pedestrian . After the offending car hitting the lady , crashed into a stationary car which spun and again hit the lady.",,,,,,,3645,1,North West,Unknown
12-09-2022,08:45 AM,210887,Ashwani,11-May-22,0887,123,23:00,17-08-2021,Hit Pedestrian,TRUE,FALSE,FALSE,Fatal Crash,1,0,1,Unknown,,"Near Petrol Pump , Meera Bagh","Outer Ring Road ,","Paschim vihar , Delhi",29,77,A pedestrian was found injured on road and taken  to hospital by public . No details of incident avaialable and no eyewitness for the same .,,,,,,,3646,2,East,Unknown
12-09-2022,08:45 AM,210939,Ashwani,11-May-22,0939,123,00:00,10-07-2021,Hit Pedestrian,TRUE,FALSE,FALSE,Fatal Crash,1,0,1,Unknown,,"Ring Road Peeragarhi flyover,",Towards Janakpuri Paschim vihar,,29,77,One pedestrian found injured on road . When taken to hospital by CATS ambulance was declared DOA.,,,,,,,3647,2,North West,Unknown
12-09-2022,08:45 AM,211000,Ashwani,11-May-22,1000,123,00:00,19-09-2021,Unknown,TRUE,FALSE,FALSE,Fatal Crash,1,0,2,Unknown,,Opposite Cottage Enclave,Towards Peeragarhi chowk,"Rohtak road ,  Delhi",29,77,"A scooty was hit by unknown vehicle , this led to injury of scooty rider . He was taken to hospital by PCR .",,,,,,,3648,0,,Unknown
12-09-2022,08:45 AM,211074,Ashwani,12-May-22,1074,123,21:00,18-10-2021,Unknown,FALSE,FALSE,FALSE,Fatal Crash,1,0,2,Unknown,,Vikaspuri Flyover,Near Picaso Hotel,"Paschim Vihar , Delhi",29,77,A tempo and bike collided this resulted in injuries tomthe bike rider and when taken to hospital was declared dead . The offending vehicle and driver were there on site .,,,,,,,3649,2,South west,Unknown
12-09-2022,08:45 AM,21115,Ashwani,12-May-22,1115,123,01:20,02-11-2021,Unknown,FALSE,FALSE,FALSE,Fatal Crash,1,1,2,Unknown,,Near Metro Pillar no 262,Main Rohtak Road,,29,77,A truck had hit one scooty injuring the pillion rider and killing the rider . No other details available in FIR.,,,,,,,3650,1,North,Unknown
12-09-2022,08:45 AM,211124,Ashwani,12-May-22,1124,123,09:15,07-11-2021,Single Vehicle Overturn,FALSE,FALSE,FALSE,Fatal Crash,1,1,1,Unknown,,"Ganda Nala Road ,Near meera Bagh","JJ Cluster , Paschim Vihar",Delhi,29,77,E-Rickshaw was hired by a family and friends for going to relatives place on the way The rider of rickshaw was overspeeding which overturned the vehicle . Injuring one passenger and killing the other .,,,,,,,3651,2,South,Not Applicable
12-09-2022,08:45 AM,210094,Ashwani,12-May-22,0094,124,16:30,25-03-2021,Backend Collision,FALSE,FALSE,FALSE,Fatal Crash,1,0,2,Unknown,,Peeragarhi metro station,"Towards Nangloi ,",Peeragarhi Delhi,29,77,"A cyclist was hit  run over by tempo , when taken to hospital by PCR he was declared Dead .",,,,,,,3652,2,North,Same Direction
12-09-2022,08:45 AM,210436,Ashwani,12-May-22,0436,124,23:15,13-06-2021,Unknown,TRUE,TRUE,FALSE,Fatal Crash,1,0,2,Unknown,,"Main Rohtak road ,Udyog Nagar",Under Metro Station,,29,77,"One scooty was hit by truck, injuring the rider . He was taken to hospital by family . No other details of offending vehicle available .",,,,,,,3653,1,North,Unknown
12-09-2022,08:45 AM,210450,Ashwani,12-May-22,0450,124,09:00,15-06-2021,Single Vehicle Run of the Road,FALSE,FALSE,FALSE,Fatal Crash,1,0,1,Unknown,,"Gando Nala , nihal vihar",Delhi,,29,77,"A Motorcycle slipped on the road , this led to the death of the rider .",,,,,,,3654,0,,Unknown
12-09-2022,08:45 AM,210828,Ashwani,12-May-22,"0828

0828",124,04:30,30-09-2021,Hit Pedestrian,TRUE,FALSE,FALSE,Fatal Crash,1,0,1,Unknown,,Underpass Bhairo Enclave,"Outer Ring Road ,","Janakpuri to Peeragarhi , Delhi",29,77,one unidentified person was found injured near the Underpass. When taken to hospital by ambulance was declared dead .,,,,,,,3655,2,,Unknown
12-09-2022,08:45 AM,210878,Ashwani,12-May-22,0878,124,19:45,21-10-2021,Hit Pedestrian,TRUE,FALSE,FALSE,Fatal Crash,1,0,1,Unknown,,"DTC Bus Stand Route no 910,","Saiyad Village, Paschim Vihar",Delhi,29,77,One Pedestrian was found injured by public and taken to hospital where he was declared DOA. The offending vehicle was unknown .,,,,,,,3656,2,South West,Unknown
12-09-2022,08:45 AM,210943,Ashwani,12-May-22,0943,124,04:45,07-11-2021,Unknown,TRUE,FALSE,FALSE,Fatal Crash,1,1,2,Unknown,,"Flyover , keshopur Nala",Towards Meera Bagh Carriage way,,29,77,One motorcycle was hit in crash by unknown vehicle . The pillion rider was declared DOA and driver of the bike was injured .,,,,,,,3657,2,South East,Unknown
12-09-2022,08:45 AM,210973,Ashwani,12-May-22,0973,124,05:30,21-11-2021,Unknown,FALSE,FALSE,FALSE,Fatal Crash,2,0,2,Unknown,,"Jwalapuri Red Light ,","Opposite DTC Bus Depot ,",Rohtak Road .,29,77,One Auto rickshaw was hit by truck killing two passengers .,,,,,,,3658,0,,Unknown
12-09-2022,08:45 AM,210976,Ashwani,12-May-22,0976,124,18:00,22-11-2021,Hit Pedestrian,TRUE,FALSE,FALSE,Fatal Crash,1,0,1,Unknown,,"GH-14 , Apartment ,",Sai Mandir,,29,77,One pedestrian was hit by unknown vehicle .,,,,,,,3659,0,,Unknown
12-09-2022,08:45 AM,210982,Ashwani,12-May-22,0982,124,10:30,24-11-2021,Backend Collision,FALSE,FALSE,FALSE,Fatal Crash,1,0,2,Unknown,,Near Vodafone Idea Showroom,Rohtak Road,,29,77,One bus had hit scooty due to which the rider fell down and the bus ran over him . When the victim was taken to hospital was declared DOA.,,,,,,,3660,1,North,Same Direction
12-09-2022,08:45 AM,210981,Ashwani,12-May-22,0981,124,00:57,24-11-2021,Unknown,FALSE,FALSE,FALSE,Fatal Crash,1,0,2,Unknown,,"IGL Peeragarhi,",Janakpuri - Peeragarhi Road,,29,77,One motorcycle was hit by truck. The Injured was taken to hospital and was declared DOA .,,,,,,,3661,3,,Unknown
12-09-2022,08:45 AM,211009,Ashwani,12-May-22,1009,124,23:40,01-12-2021,Backend Collision,FALSE,FALSE,FALSE,Fatal Crash,1,1,2,Unknown,,"Near Gate No 1, Sunder Vihar ,",Janakpuri to Peeragarhi road,,29,77,One motorcycle was hit from behind by Tempo.The rider and pillion rider were injured in this crash .,,,,,,,3662,2,,Same Direction
12-09-2022,08:45 AM,211054,Ashwani,12-May-22,1054,124,12:00,21-12-2021,Hit Pedestrian,TRUE,FALSE,FALSE,Fatal Crash,1,0,1,Unknown,,"Peeragarhi Metro Station ,","Near Ekta Apartments ,","Towards Nangloi ,Delhi",29,77,One pedestrian was hit by a motorcycle . The injured was taken to hospital by ambulance and later durin treatment died .,,,,,,,3663,1,West,Unknown
12-09-2022,08:45 AM,210009,Ashwani,12-May-22,0009,125,20:30,07-01-2021,Hit Pedestrian,TRUE,FALSE,FALSE,Fatal Crash,1,1,0,Unknown,,"DMS Colony Road , Near SBI",,,29,77,Two pedestrians were brought to hospital injured . They were hit by some unknow vehicle .,,,,,,,3664,1,North,Unknown
12-09-2022,08:45 AM,210063,Ashwani,12-May-22,0063,126,06:30,20-02-2021,Unknown,FALSE,FALSE,FALSE,Fatal Crash,1,0,1,Unknown,,"Railway Flyover ,",Near ISBT Anand vihar,Road no 56,29,77,A motorcyclist was found injured on road and no eyewitness was found of the incident.,,,,,,,3665,1,North,Unknown
12-09-2022,08:45 AM,210163,Ashwani,12-May-22,0163,126,15:30,08-05-2021,Hit Pedestrian,FALSE,FALSE,FALSE,Fatal Crash,1,0,1,Unknown,,"Parking no 1 , opposite EDM Mall",Delhi,,29,77,One pedestrian was hit and crushed under the rear wheels of the bus . The driver of the bus was  reversing the bus when this incident occurred .,,,,,,,3666,2,East,Opposite Direction
12-09-2022,08:45 AM,210171,Ashwani,12-May-22,0171,126,01:10,20-05-2021,Single Vehicle Run of the Road,FALSE,FALSE,FALSE,Fatal Crash,1,0,1,Unknown,,Near EDM Toll Tax Picket,Opposite Gomukh Apt.,"Sabji Mandi Road, Delhi",29,77,"One  Motorcycle rider slipped on road along with his bike , due to rain and hit the divider . He sustained head injuries .",,,,,,,3667,2,South,Not Applicable
12-09-2022,08:45 AM,210194,Ashwani,12-May-22,0194,126,15:30,06-06-2021,Unknown,TRUE,FALSE,FALSE,Fatal Crash,1,0,2,Unknown,,"Gazipur , Near CNG Pump",Sabji Mandi Road,,29,77,"One motorcyclist was hit by unknown vehicle , taken to hospital by ambulance .",,,,,,,3668,2,South,Unknown
12-09-2022,08:45 AM,210303,Ashwani,12-May-22,0303,126,09:10,26-08-2021,Hit Pedestrian,FALSE,FALSE,FALSE,Fatal Crash,1,0,1,Unknown,,Counter no 79-80,Anand Vihar ISBT,,29,77,One worker was crushed under the rear wheels of the bus and died on the spot .,,,,,,,3669,1,North,Not Applicable
12-09-2022,08:45 AM,210348,Ashwani,12-May-22,0348,126,15:00,13-09-2021,Single Vehicle Run of the Road,FALSE,FALSE,FALSE,Fatal Crash,1,0,1,Unknown,,"Sabji Mandi road ,",Opposite Gazipur Mandi,,29,77,One Bike slipped and caused fatal injury to the pillion rider . She died on the spot .,,,,,,,3670,2,South East,Not Applicable
12-09-2022,08:45 AM,210418,Ashwani,13-May-22,0418,126,18:40,24-10-2021,Hit Pedestrian,TRUE,FALSE,FALSE,Fatal Crash,1,0,1,Unknown,,"Road No 56, Flyover Telco T Point","Gazipur , Delhi",,29,77,One unknown pedestrian was found on road .,,,,,,,3671,2,South East,Unknown
12-09-2022,08:45 AM,210433,Ashwani,13-May-22,0433,126,22:00,02-11-2021,Hit Pedestrian,TRUE,FALSE,FALSE,Fatal Crash,1,0,1,Unknown,,Anand Vihar Railway Station,Flyover towards Gazipur,Delhi,29,77,One person was found injured on road and taken to hospital by PCR .,,,,,,,3672,2,North East,Unknown
12-09-2022,08:45 AM,210485,Ashwani,13-May-22,0485,126,00:00,21-11-2021,Hit Pedestrian,TRUE,FALSE,FALSE,Fatal Crash,1,0,1,Unknown,,Near Goushala T intersection,"Bhovapur, Sabji Mandi Road",Delhi,29,77,One person was found injured on road and when taken to hospital was declared DOA .,,,,,,,3673,2,south,Unknown
12-09-2022,08:45 AM,210503,Ashwani,13-May-22,0503,126,17:51,03-12-2021,Hit Pedestrian,FALSE,FALSE,FALSE,Fatal Crash,1,0,1,Unknown,,Infront of Phool Mandi,Gazipur Delhi,,29,77,"One person was filling air in his bicycle when a truck was reversing , the driver of the truck didnt notice the person sitting . The truck hit the person and crushed his skull under the rear wheels .",,,,,,,3674,1,North,Opposite Direction
12-09-2022,08:45 AM,210086,Ashwani,13-May-22,0086,122,16:00,20-03-2021,Hit Pedestrian,TRUE,FALSE,FALSE,Fatal Crash,1,0,1,Unknown,,Kali Mata Mandir Hill Apartment,"T point sector -13, Rohini",Delhi,29,77,One pedestrian girl was found injured and tsken to hospital was declared DOA .,,,,,,,3675,1,,Unknown
12-09-2022,08:45 AM,210471,Ashwani,13-May-22,0471,122,11:47,24-07-2021,Hit Pedestrian,TRUE,FALSE,FALSE,Fatal Crash,1,0,1,Unknown,,In front of City Center Mall,"Sector 10 , Rohini  , Delhi",,29,77,One pedestrian was hit by a motorcycle and was rushed to hospital by public .,,,,,,,3676,2,South,Unknown
12-09-2022,08:45 AM,210543,Ashwani,13-May-22,0543,122,00:15,19-08-2021,Hit Pedestrian,TRUE,FALSE,FALSE,Fatal Crash,1,0,1,Unknown,,Near White House Apt.,"Sector 12 , Rohini",,29,77,One pedestrian was hit by car when he was crossing road . He was declared DOA when taken by family.,,,,,,,3677,1,,Perpendicular Direction
12-09-2022,08:45 AM,210616,Ashwani,13-May-22,0616,122,12:03,22-10-2021,Hit Pedestrian,TRUE,FALSE,FALSE,Fatal Crash,1,0,1,Unknown,,Opp. Sheetal Apt.,Near RG Complex,"Prashant Vihar , Rohini , Delhi",29,77,One pedestrian was found injured on road ant was taken to hospital by family . No eyewitness was available so no details of the crash .,,,,,,,3678,2,,Unknown
12-09-2022,08:45 AM,210208,Ashwani,13-May-22,0208,127,12:20,21-06-2021,Unknown,TRUE,FALSE,FALSE,Fatal Crash,1,0,2,Unknown,,"Near 24 Chitra Vihar , Delhi",,,29,77,"One Motorcyclist was hit by unknown vehicle , he was taken to hospital by public.",,,,,,,3679,2,East,Unknown
12-09-2022,08:45 AM,210275,Ashwani,13-May-22,0275,127,07:40,05-08-2021,Unknown,TRUE,FALSE,FALSE,Fatal Crash,1,0,2,Unknown,,"Vikas Marg , Preet Vihar",,,29,77,One motorcycle rider was found injured on road and taken to hospital . He was under treatment when died .,,,,,,,3680,1,North West,Unknown
