Auto_Date,Auto_Time,Form_No,Entry_Personnel,Filled_Date,FIR_No,Police_Station,Time_Of_Crash,Date_Of_Crash,Collision_Type,Hit_and_Run,Special_Case,Case File Available,Crash_Severity,No_Of_ Fatalities,No_Of_ Injured,No_Of_Vehicles,Location,Road_Type,Road_1,Road_2,Road_3,GPS_Lat,GPS_Long,Note,No_of_Lanes,Curb_Type,Shoulder_Type,Median_Type,Light_Condition,Weather_Condition,Crash_ID,Distance_From_Landmark,Text97,Veh_Rel_Travel_Dir
12-09-2022,08:45 AM,210194,Ashwani,26-May-22,0194,155,13:00,10-06-2021,Single Vehicle Run of the Road,FALSE,FALSE,FALSE,Fatal Crash,1,0,1,Unknown,,Shaheen Bagh,,,29,77,A bike rider fell off the bike due to unknown reasons on his own .,,,,,,,3846,2,East,Not Applicable
12-09-2022,08:45 AM,210326,Ashwani,26-May-22,0326,155,14:45,28-09-2021,Backend Collision,TRUE,FALSE,FALSE,Fatal Crash,1,1,2,Unknown,,Kalandi Kunj Road New Basti,"Jamia Nagar , New Delhi",,29,77,A bike was hit by tempo from behind and ran over the rider when he fell down .,,,,,,,3847,2,South East,Same Direction
12-09-2022,08:45 AM,210159,Ashwani,26-May-22,0159,156,22:10,01-05-2022,Backend Collision,TRUE,FALSE,FALSE,Fatal Crash,1,1,2,Unknown,,"Vikas Marg , Opp. Hira Sweets,",Near Bus Stop Shakarpur,Delhi,29,77,"A scooty was hit from behind by truck , fatally injuring the pillion rider and ran over her .Even the rider got injured .",,,,,,,3848,2,Nort East,Same Direction
12-09-2022,08:45 AM,210342,Ashwani,26-May-22,0342,156,00:07,07-08-2021,Single Vehicle Overturn,FALSE,FALSE,FALSE,Fatal Crash,2,0,1,Unknown,,"Mother Dairy Flyover ,","Near Toilet Ganesh Nagar ,","2nd Police Booth , Delhi",29,77,A bike was found in accidental contion and both the rider and pillion rider were injured .,,,,,,,3849,2,North West,Not Applicable
12-09-2022,08:45 AM,210487,Ashwani,26-May-22,0487,156,10:45,11-10-2021,Backend Collision,FALSE,FALSE,FALSE,Fatal Crash,1,0,2,Unknown,,"Akshardham Flyover, Near Yamuna Bank","Bus Stand , Shakarpur",Delhi,29,77,A cycle rickshaw was hit from behind by a speeding car .,,,,,,,3850,3,North west,Same Direction
12-09-2022,08:45 AM,210130,Ashwani,26-May-22,0130,157,11:10,03-03-2021,Head on Collision,FALSE,FALSE,FALSE,Fatal Crash,1,1,2,Unknown,,"Ring Road towards Azadpur,","AC Block , Shalimar Bagh",Delhi,29,77,A truck had hit a scooty injuring the rider and killing the pillion on the spot.,,,,,,,3851,2,,Same Direction
12-09-2022,08:45 AM,210415,Ashwani,26-May-22,0415,157,16:19,02-06-2021,Unknown,TRUE,FALSE,FALSE,Fatal Crash,1,0,2,Unknown,,"Near Sahib Singh Verma Dawar,","Ring Road , Shalimar Bagh",Delhi,29,77,A bike rider was hit by unknown vehicle and he died .,,,,,,,3852,2,South East,Unknown
12-09-2022,08:45 AM,210027,Ashwani,26-May-22,0027,157,19:00,10-01-2021,Hit Pedestrian,TRUE,FALSE,FALSE,Fatal Crash,1,0,1,Unknown,,"Outer Ring road ,","Near Pillar no 57, Haiderpur,",Delhi,29,77,A pedestrian was hit by unknow vehicle.,,,,,,,3853,2,North,Unknown
12-09-2022,08:45 AM,210085,Ashwani,27-May-22,0085,157,09:00,08-02-2021,Hit Pedestrian,TRUE,FALSE,FALSE,Fatal Crash,1,0,1,Unknown,,Ambedkar Nahar Backside,,,29,77,A pedestrian was hit by unknown vehicle .,,,,,,,3854,0,,Unknown
12-09-2022,08:45 AM,210098,Ashwani,27-May-22,"0098
0098",157,22:30,17-02-2021,Hit Pedestrian,TRUE,FALSE,FALSE,Fatal Crash,1,0,1,Unknown,,Opp. Indian Oil Petrol Pump,"Outer Ring Road , towards Mukarba",Chowk Delhi,29,77,A pedestrian was injured as a truck almost hit her and she fell from flyover while saving herself from the truck.,,,,,,,3855,2,North East,Unknown
12-09-2022,08:45 AM,210190,Ashwani,27-May-22,0190,157,12:30,03-04-2021,Hit Pedestrian,FALSE,FALSE,FALSE,Fatal Crash,1,0,1,Unknown,,Near Main Gate Fortis Hospital,Shalimar Bagh,,29,77,A pedestrian was hit by a truck .,,,,,,,3856,1,South East,Unknown
12-09-2022,08:45 AM,210197,Ashwani,27-May-22,0197,157,05:43,05-04-2021,Hit Pedestrian,TRUE,FALSE,FALSE,Fatal Crash,1,0,1,Unknown,,"Near Max Hospital , Shalimar Bagh",Delhi,,29,77,A pedestrian was hit by E Rickshaw and got injured . He was  taken to hospital by PCR Van and declared dead by doctor .,,,,,,,3857,1,North West,Unknown
12-09-2022,08:45 AM,210372,Ashwani,27-May-22,0372,157,21:40,21-05-2021,Unknown,TRUE,FALSE,FALSE,Fatal Crash,1,0,2,,,"Near Badli Metro Station ,","Madhuban Chowk ,Outer Ring Road",Delhi,29,77,A scooty rider was hit by unknown vehicle and when injured taken to hospital by CATS ambulance was DOA .,,,,,,,3858,2,North,Unknown
12-09-2022,08:45 AM,210558,Ashwani,27-May-22,0558,157,08:49,08-07-2021,Backend Collision,FALSE,FALSE,FALSE,Fatal Crash,1,1,2,Unknown,,"Outer Ring road , Towards","Karnal By pass, Delhi",,29,77,"An auto rammed his vehicle into a parked police van , The injured were taken to hospital by auto .",,,,,,,3859,2,,Same Direction
12-09-2022,08:45 AM,210756,Ashwani,27-May-22,0756,157,21:30,11-08-2021,Hit Pedestrian,TRUE,FALSE,FALSE,Fatal Crash,1,0,1,Unknown,,Near Prembari Pul,"Service Road , Shalimar Bagh",Delhi,29,77,A pedestrian was hit by unknown vehicle and taken to hospital by CATS ambulance for traetment.,,,,,,,3860,2,North East,Unknown
12-09-2022,08:45 AM,210781,Ashwani,27-May-22,0781,157,23:40,05-09-2021,Backend Collision,TRUE,FALSE,FALSE,Fatal Crash,1,1,2,Unknown,,Near Haiderpur Metro Staion,"Outer Ring Road , Towards","Mukarba Chowk , Delhi",29,77,A truck had hit one motorcycle and moped from behind . Killing the moped rider on the spot and injuring the bike rider .,,,,,,,3861,2,North,Same Direction
12-09-2022,08:45 AM,210807,Ashwani,27-May-22,0807,157,08:41,12-09-2021,Unknown,TRUE,FALSE,FALSE,Fatal Crash,1,0,2,Unknown,,Near Haiderpur Badli Mor Metro Station,Flyover towards Mukarba Chowk,"Outer Ring Road , Delhi",29,77,A bike rider was hit and killed by unknown vehicle .,,,,,,,3862,2,East,Unknown
12-09-2022,08:45 AM,210133,Ashwani,27-May-22,0133,157,22:40,04-03-2021,Hit Pedestrian,TRUE,FALSE,FALSE,Fatal Crash,1,0,1,Unknown,,"Outer Ring Road ,",Near Petrol Pump,"Haiderpur , Delhi",29,77,A pedestrian was hit by unknown vehicle .,,,,,,,3863,2,North,Unknown
12-09-2022,08:45 AM,210060,Ashwani,27-May-22,0060,158,00:30,08-02-2021,Hit Pedestrian,TRUE,FALSE,FALSE,Fatal Crash,1,0,1,Unknown,,"Near shiv Mandir , Aggarwal Sweets",Khjoori Khas to Shastri Park Road,,29,77,A pedestrian was hit by unknown vehicle and taken to hospital by auto .There he was declared DOA .,,,,,,,3864,6,North East,Unknown
12-09-2022,08:45 AM,210218,Ashwani,27-May-22,0218,158,08:45,28-04-2021,Single Vehicle Overturn,FALSE,FALSE,FALSE,Fatal Crash,1,0,1,Unknown,,"Signature Bridge , Khajoori Khas SIDE",,,29,77,A bike overturned and injured and killed the rider.,,,,,,,3865,6,,Not Applicable
12-09-2022,08:45 AM,210560,Ashwani,27-May-22,0560,158,02:16,03-09-2021,Single Vehicle Overturn,FALSE,FALSE,FALSE,Fatal Crash,1,0,1,Unknown,,towards Bhajanpura To Signature bridge,Near Pole no 28,Shastri Park,29,77,"A biker was involved in bike overturn incident , causing fatal injuries to him .",,,,,,,3866,5,,Not Applicable
12-09-2022,08:45 AM,210003,Ashwani,27-May-22,0003,158,10:30,31-12-2021,Single Vehicle Hit Fixed Object,FALSE,FALSE,FALSE,Fatal Crash,1,0,1,Unknown,,"New Seelampur Flyover,",Shahdara to ISBT side,,29,77,Bike rider had hit divider while driving and died due to injuries .,,,,,,,3867,0,North east,Not Applicable
12-09-2022,08:45 AM,210010,Ashwani,27-May-22,0010,158,05:45,03-01-2021,Backend Collision,TRUE,FALSE,FALSE,Fatal Crash,1,0,2,Unknown,,"GT road Near Shastri Park,","Metro bus Stand , Towards ISBT",,29,77,A hand cart puller was hit by DTC bus and died due to injuries.,,,,,,,3868,2,North East,Same Direction
12-09-2022,08:45 AM,210076,Ashwani,27-May-22,0076,158,03:30,15-02-2021,Head on Collision,TRUE,FALSE,FALSE,Fatal Crash,1,0,2,Unknown,,"Old GT road , Near Police Booth,",T point Dharampura Wine shop,,29,77,A bike crashed with a truck due to this the bike got stuck in the bus and caught fire . The injured rider died due to injuries and burns .,,,,,,,3869,1,North East,Opposite Direction
12-09-2022,08:45 AM,210081,Ashwani,27-May-22,0081,158,14:00,18-02-2021,Hit Pedestrian,TRUE,FALSE,FALSE,Fatal Crash,1,0,1,Unknown,,Shastri Park IT Building,,,29,77,A pedestrian was found injured and when taken to hospital was declared DOA,,,,,,,3870,1,North East,Unknown
12-09-2022,08:45 AM,210106,Ashwani,27-May-22,0106,158,10:00,01-03-2021,Hit Pedestrian,TRUE,FALSE,FALSE,Fatal Crash,1,0,1,Unknown,,Main Gate Dr AkhileshDas Gupta,"Engineering College, Near JPC Hospital","Shastri Park, Delhi",29,77,A pedestrian was hit by a bike on the road .,,,,,,,3871,1,,Unknown
12-09-2022,08:45 AM,210123,Ashwani,27-May-22,0123,158,08:00,12-03-2021,Hit Pedestrian,TRUE,FALSE,FALSE,Fatal Crash,1,0,1,Unknown,,4th pusta Main Road,"Shastri park , Delhi",,29,77,A pedestrian was hit by unknown vehicle .,,,,,,,3872,1,East,Unknown
12-09-2022,08:45 AM,210177,Ashwani,27-May-21,0177,158,20:30,10-04-2021,Single Vehicle Overturn,FALSE,FALSE,FALSE,Fatal Crash,1,0,1,Unknown,,"Old GT road ,","Near Furniture Market,",Shastri Park,29,77,A bike rider was found injured on road and taken to Hospital.,,,,,,,3873,1,North east,Not Applicable
12-09-2022,08:45 AM,210254,Ashwani,30-May-22,0254,158,20:30,26-05-2021,Hit Pedestrian,FALSE,FALSE,FALSE,Fatal Crash,1,0,1,Unknown,,On Road Teen Pusta,"Kartar Nagar ,Delhi",,29,77,A motorcycle crashed into a pedestrian and fatally injuring him .,,,,,,,3874,2,,Unknown
12-09-2022,08:45 AM,210391,Ashwani,30-May-22,0391,158,20:00,14-07-2021,Hit Pedestrian,TRUE,FALSE,FALSE,Fatal Crash,1,0,1,Unknown,,"Shastri park flyover ,",Towards Seelampur side.,,29,77,An unknown pedestrian was found injured on flyover and when taken to hospital was declared DOA.,,,,,,,3875,0,,Unknown
12-09-2022,08:45 AM,210392,Ashwani,30-May-22,0392,158,00:10,15-07-2021,Unknown,TRUE,FALSE,FALSE,Fatal Crash,1,0,2,Unknown,,"Shastri Park Flyover , from ISBT side",Opp. Hanuman Mandir,Shastri Park Delhi,29,77,An auto was hit by unknown vehicle causing injuries to the driver .,,,,,,,3876,0,,Unknown
12-09-2022,08:45 AM,210462,Ashwani,30-May-22,0462,158,01:55,03-08-2021,Unknown,TRUE,FALSE,FALSE,Fatal Crash,1,2,2,Unknown,,"Shahdara to ISBT side,","Seelampur Flyover,",Dharampur Red Light.,29,77,A bike was hit by unknown vehicle and causing injuries to rider and pillion riders .,,,,,,,3877,1,,Unknown
12-09-2022,08:45 AM,210551,Ashwani,30-May-22,0551,158,14:45,31-08-2021,Hit Pedestrian,TRUE,FALSE,FALSE,Fatal Crash,1,0,1,Unknown,,"Main GT Road ,",Near Dharampur Red Light,From ISBT to Shahdara.,29,77,A pedestrian kid was hit by a tempo . While under treatment he passed away .,,,,,,,3878,1,,Unknown
12-09-2022,08:45 AM,210554,Ashwani,30-May-22,0554,158,23:30,31-08-2021,Hit Pedestrian,TRUE,FALSE,FALSE,Fatal Crash,1,0,1,Unknown,,3rd Pusta Yamuna,"Khadar Road , Delhi",,29,77,"An unknown pedestrian was hit by unknown vehicle , when taken to hospital was declared DOA.",,,,,,,3879,4,,Unknown
12-09-2022,08:45 AM,210726,Ashwani,30-May-22,0726,158,22:10,27-11-2021,Backend Collision,FALSE,FALSE,FALSE,Fatal Crash,1,1,2,Unknown,,ISBT to Shahdara,"Main GT Road , Near Police Booth",Delhi,29,77,A bike was hit by a truck injuring the rider and ran over the pillion rider . Killing the pillion on the spot.,,,,,,,3880,2,North West,Same Direction
12-09-2022,08:45 AM,210757,Ashwani,30-May-22,0757,158,03:30,10-12-2021,Unknown,TRUE,FALSE,FALSE,Fatal Crash,1,0,2,Unknown,,Shastri park Flyover,"ISBT to Seelampur ,",Poll no 7 & 8,29,77,"A scooty was hit by unknown vehicle , injuring and causing death of driver .",,,,,,,3881,1,,Unknown
12-09-2022,08:45 AM,210776,Ashwani,30-May-22,0776,158,12:00,16-12-2021,Unknown,TRUE,FALSE,FALSE,Fatal Crash,1,1,2,Unknown,,"3rd Pusta Near Forest Office ,","Yamuna Khadar , Shastri Park",Delhi,29,77,One scooty was hit by unknown vehicle and both the rider and pillion were injured .,,,,,,,3882,4,,Unknown
12-09-2022,08:45 AM,210003,Ashwani,30-May-22,0003,159,07:00,02-01-2021,Hit Pedestrian,TRUE,FALSE,FALSE,Fatal Crash,1,0,1,Unknown,,"Zero Pusta , sonia Vihar",Delhi,,29,77,A pedestrian was hit by a car . The pedestrian was declared DOA in hospital .,,,,,,,3883,2,North East,Unknown
12-09-2022,08:45 AM,210055,Ashwani,30-May-22,0055,159,16:20,02-03-2021,Backend Collision,FALSE,FALSE,FALSE,Fatal Crash,2,0,2,Unknown,,3rd Pusta Near Police Booth,"Sonia Vihar , Delhi",,29,77,One scooty was hit by roadways bus and ran over both the rider and pillion rider .,,,,,,,3884,1,South,Same Direction
12-09-2022,08:45 AM,210263,Ashwani,30-May-22,0263,159,07:00,27-07-2021,Backend Collision,FALSE,FALSE,FALSE,Fatal Crash,1,0,2,Unknown,,"Main Pusta Road ,","Annapurna Mandir , Sonia Vihar",Delhi,29,77,A cyclist was hit by a car from behind and the impact resulted in injuries and later death of victim .,,,,,,,3885,1,North East,Same Direction
12-09-2022,08:45 AM,210010,Ashwani,30-May-22,0010,160,10:30,05-04-2021,Backend Collision,FALSE,FALSE,FALSE,Fatal Crash,1,0,2,Unknown,,"Kushak Road , Near Nursury","South Avenue , New Delhi",,29,77,A cyclist was hit by a car and sustained injuries due to impact . The victim was taken to hospital by offending car .,,,,,,,3886,0,South,Same Direction
12-09-2022,08:45 AM,210105,Ashwani,30-May-22,0105,164,05:58,22-02-2021,Unknown,TRUE,FALSE,FALSE,Fatal Crash,1,1,2,Unknown,,"Near Shiv Dairy , Main",Khanjhawala Road,Sultan Puri Delhi,29,77,A motorcycle was hit by unknown vehicle and both the rider and pillion got injured .,,,,,,,3887,2,North,Unknown
12-09-2022,08:45 AM,211057,Ashwani,30-May-22,1057,164,22:30,23-08-2021,Sideswipe (Same Direction),TRUE,FALSE,FALSE,Fatal Crash,1,0,2,Unknown,,Main Kanjhawala Road,Near Satya Narayan Hospital,,29,77,"A motorcyclist got unbalanced while driving through a deep pit on the road , consequently hitting a side passing vehicle . The impact resulted in head injuries.",,,,,,,3888,1,,Same Direction
12-09-2022,08:45 AM,211204,Ashwani,30-May-22,1204,164,23:34,14-10-2021,Unknown,TRUE,FALSE,FALSE,Fatal Crash,1,0,2,Unknown,,"C-8 Block , Near Mother Dairy","BC Chowk , Sultanpuri",Delhi,29,77,"A scooty rider was hit by some unknown vehicle , the injuries led to the rider's death.",,,,,,,3889,1,,Unknown
12-09-2022,08:45 AM,211375,Ashwani,30-May-22,1375,164,13:00,16-12-2021,Hit Pedestrian,TRUE,FALSE,FALSE,Fatal Crash,1,0,1,Unknown,,Budh Vihar Kanjhawal,Ganda Nala,,29,77,A pedestrian was hit by unknown vehicle and declared dead in hospital .,,,,,,,3890,2,,Unknown
12-09-2022,08:45 AM,210822,Ashwani,30-May-22,0822,164,21:00,04-07-2021,Unknown,FALSE,FALSE,FALSE,Fatal Crash,1,0,2,Unknown,,"Near Jalebi Chowk ,","Sultan Puri , Delhi",,29,77,A E-Rickshaw rider was hit by a crane and got injured.,,,,,,,3891,2,,Same Direction
12-09-2022,08:45 AM,210340,Ashwani,30-May-22,0340,165,22:50,08-07-2021,Unknown,TRUE,FALSE,FALSE,Fatal Crash,1,0,2,Unknown,,"NH 24 , Yamuna Bridge ,","Near Light Pillar no 26,","Towards Sarai Kale Khan , Delhi",29,77,A motorcyclist was hit by a unkown bus and causing death of bike rider.,,,,,,,3892,2,North East,Unknown
12-09-2022,08:45 AM,210006,Ashwani,30-May-22,0006,165,22:00,10-01-2021,Unknown,TRUE,FALSE,FALSE,Fatal Crash,1,0,2,Unknown,,"Ring Road Near Sun Dial Loop,",Near Khijrabad Kaccha Rasta,,29,77,A motorcyclust was hit by unknown vehicle and died due to injuries .,,,,,,,3893,1,North,Unknown
12-09-2022,08:45 AM,210024,Ashwani,31-May-22,0024,165,09:30,23-01-2021,Unknown,TRUE,FALSE,FALSE,Fatal Crash,1,0,2,Unknown,,DND Flyover Towards Noida,Near Ashram Chowk,,29,77,One Motorcyclist was hit by unknown vehicle and was taken to hospital by PCR.,,,,,,,3894,2,North east,Unknown
12-09-2022,08:45 AM,210045,Ashwani,31-May-22,0045,165,11:30,21-02-2021,Unknown,TRUE,FALSE,FALSE,Fatal Crash,1,1,2,Unknown,,Ring Road Near Milinium Bus Depo,Flyover Sarai Kale Khan,,29,77,A scooty was hit by unknown vehicle injuring the pillion and causing death of rider .,,,,,,,3895,2,North East,Unknown
12-09-2022,08:45 AM,210079,Ashwani,31-May-22,0079,165,00:25,24-03-2021,Single Vehicle Overturn,FALSE,FALSE,FALSE,Fatal Crash,2,3,1,Unknown,,DND Loop towards Delhi,"Under Loop , Bridge",,29,77,A truck overturned on the LOOP of the bridge,,,,,,,3896,0,East,Not Applicable
12-09-2022,08:45 AM,210091,Ashwani,31-May-22,0091,165,22:30,01-04-2021,Unknown,TRUE,FALSE,FALSE,Fatal Crash,1,0,2,Unknown,,Barapulla Flyover Loop,"Towards Noida, Near Sun Dial Park","Yamuna Khader , Delhi",29,77,"A scooty rider was hit by an unknown vehicle , the impact led to the fall of the rider from the flyover .",,,,,,,3897,2,North,Unknown
12-09-2022,08:45 AM,210190,Ashwani,31-May-22,0190,165,06:50,15-04-2021,Unknown,TRUE,FALSE,FALSE,Fatal Crash,1,0,2,Unknown,,"NH 9, Yamuna Bridge",Towards Meerut,Delhi,29,77,A motorcycle rider was hit by unknown vehicle .,,,,,,,3898,2,North,Unknown
12-09-2022,08:45 AM,210325,Ashwani,31-May-22,0325,165,17:00,19-06-2021,Hit Pedestrian,TRUE,FALSE,FALSE,Fatal Crash,1,0,1,Unknown,,"T intersection , Red Light ,",Opp. IP Park.,,29,77,A pedestrian was hit by unknown vehicle and was rushe to hospital in ambulance.,,,,,,,3899,2,North,Unknown
12-09-2022,08:45 AM,210362,Ashwani,31-May-22,0362,165,22:32,30-07-2021,Unknown,TRUE,FALSE,FALSE,Fatal Crash,1,0,2,Unknown,,Before DND Flyover,Bridge Loop,,29,77,A bike rider was hit by unknown vehicle and was taken to hospitalby PCR van .,,,,,,,3900,2,East,Unknown
12-09-2022,08:45 AM,210410,Ashwani,31-May-22,0410,165,07:30,01-09-2021,Hit Pedestrian,TRUE,FALSE,FALSE,Fatal Crash,1,1,1,Unknown,,"Sarai Kale Khan , IP Park,",Near Bus Stand,,29,77,Two pedestrians were hit by unknown vehicle injuring both of them . No other details available in records.,,,,,,,3901,2,North East,Unknown
12-09-2022,08:45 AM,210411,Ashwani,31-May-22,0411,165,15:56,02-09-2021,Hit Pedestrian,TRUE,FALSE,FALSE,Fatal Crash,1,0,1,Unknown,,Ring Road towards ITO,Sarai Kale Khan,,29,77,A pedestrian was hit by unknown vehicle and was taken to hospital .,,,,,,,3902,2,North,Unknown
12-09-2022,08:45 AM,210420,Ashwani,31-May-22,0420,165,20:30,07-09-2021,Hit Pedestrian,TRUE,FALSE,FALSE,Fatal Crash,1,0,1,Unknown,,"112, Sarai Kale Khan",,,29,77,A pedestrian was hit by unknown vehicle and taken to hospital by family.,,,,,,,3903,0,North,Unknown
12-09-2022,08:45 AM,210454,Ashwani,31-May-22,0454,165,15:30,04-10-2021,Hit Pedestrian,TRUE,FALSE,FALSE,Fatal Crash,1,2,1,Unknown,,"NH 9 , towards Delhi","Near Noida Mod, Pillar no4","Sarai Kale Khan, New Delhi",29,77,03 pedestrians were injured in a crash . They were hit by unknown vehicle and no other details were available .,,,,,,,3904,2,North,Unknown
12-09-2022,08:45 AM,210487,Ashwani,31-May-22,0487,165,01:34,02-11-2021,Backend Collision,FALSE,FALSE,FALSE,Fatal Crash,1,0,2,Unknown,,"Flyover Ashram , East",Delhi,,29,77,A car crashed into a broken down truck on the road .,,,,,,,3905,1,South East,Same Direction
12-09-2022,08:45 AM,210496,Ashwani,31-May-22,0496,165,20:30,07-11-2021,Unknown,TRUE,FALSE,FALSE,Fatal Crash,1,1,2,Unknown,,"Ring Road , Opp. Waste to Wonders",park Sarai Kale Khan .,,29,77,A bike was hit by an unknown vehicle causing injuries to both the rider and pillion rider .,,,,,,,3906,2,North,Unknown
12-09-2022,08:45 AM,210547,Ashwani,31-May-22,0547,165,23:00,10-12-2021,Unknown,TRUE,FALSE,FALSE,Fatal Crash,1,0,2,Unknown,,DND Road Noida to Delhi,,,29,77,"A bike rider was hit by unknown vehicle , he was taken to hospital by public person in his acr and was declared DOA .",,,,,,,3907,2,North East,Unknown
12-09-2022,08:45 AM,210008,Ashwani,31-May-22,0008,166,21:30,05-01-2021,Head on Collision,FALSE,FALSE,FALSE,Fatal Crash,2,0,2,Unknown,,"Service road , Footover Bridge,","Swaroop Nagar , GT Road",Delhi,29,77,One bike was hit by Truck head on . Both the rider and pillion were injured and taken to hospital by ambulance where they were declared DOA.,,,,,,,3909,1,West,Opposite Direction
12-09-2022,08:45 AM,210077,Ashwani,31-May-22,0077,166,00:05,02-03-2021,Hit Pedestrian,TRUE,FALSE,FALSE,Fatal Crash,1,0,1,Unknown,,"Balaji steel , Near Azad place ,","Burari road , Swaroop Nagar",,29,77,One pedestrian was killed on the spot by an unknown vehicle .,,,,,,,3910,1,South,Unknown
12-09-2022,08:45 AM,210116,Ashwani,31-May-22,0116,166,11:57,01-04-2021,Hit Pedestrian,TRUE,FALSE,FALSE,Fatal Crash,1,0,1,Unknown,,Near Gurudwara GTK Road,Swaroop Nagar Delhi.,,29,77,A pedestrian was hit by unknown vehicle and killed the victim due to impact .,,,,,,,3911,3,West,Unknown
12-09-2022,08:45 AM,210129,Ashwani,31-May-22,0129,166,20:20,14-04-2021,Hit Pedestrian,TRUE,FALSE,FALSE,Fatal Crash,1,0,1,Unknown,,"Nangli Poona Underpass,","Upper GT Road , Swaroop Nagar",Delhi,29,77,One pedestrian was hit by unknown vehicle and died .,,,,,,,3912,3,North West,Unknown
12-09-2022,08:45 AM,210339,Ashwani,31-May-22,0339,166,08:00,30-06-2021,Hit Pedestrian,FALSE,FALSE,FALSE,Fatal Crash,1,1,1,Unknown,,"Kadipur Ibrahimpur,","Near AAP Office , Swaroop Nagar .",,29,77,"A pedestrian was hit by a bike , both the rider and pedestrian got injured  and were taken to hospital by CATS ambulance .",,,,,,,3913,4,North East,Unknown
12-09-2022,08:45 AM,210378,Ashwani,01-Jun-22,"0378
0378",166,23:00,14-07-2021,Unknown,TRUE,FALSE,FALSE,Fatal Crash,1,0,2,Unknown,,"Nangli Poona Underpass,","Near Mandir, Service Road",Delhi,29,77,One scooty rider was hit by unknown vehicle and causing death of victim .,,,,,,,3914,2,North West,Unknown
12-09-2022,08:45 AM,210379,Ashwani,01-Jun-22,0379,166,03:12,15-07-2021,Backend Collision,FALSE,FALSE,FALSE,Fatal Crash,1,2,2,Unknown,,"Near Siraspur Gurudwara , Red Light","Batra Flyover , Singhu Border",,29,77,A crane operator was hit by a car while he was on road trying to remove a broken down truck .,,,,,,,3915,2,North west,Same Direction
12-09-2022,08:45 AM,210465,Ashwani,01-Jun-22,0465,166,23:30,19-08-2021,Sideswipe (Same Direction),FALSE,FALSE,FALSE,Fatal Crash,1,0,2,Unknown,,"Near Libaspur Under Pass,",From Alipur to Karnal Bypass,,29,77,A bike was hit by a truck causing injuries to the rider and pillion rider . When the rider was taken to hospital was declared  DOA .,,,,,,,3916,2,North,Same Direction
12-09-2022,08:45 AM,210521,Ashwani,01-Jun-22,0521,166,19:26,30-09-2021,Unknown,FALSE,FALSE,FALSE,Fatal Crash,1,1,2,Unknown,,"Gali no13 ,Swaroop Nagar","Burari Road , Delhi",,29,77,A tempo and bike collided with each other injuring the rider and pillion rider of the bike . They were taken to hospital by PCR van.,,,,,,,3917,2,South East,Unknown
12-09-2022,08:45 AM,210539,Ashwani,01-Jun-22,0539,166,15:25,07-10-2021,Backend Collision,FALSE,FALSE,FALSE,Fatal Crash,1,0,2,Unknown,,"Gali no 13A, Sangam  Dharam Kanta","Burari Road , Swaroop Nagar",Delhi,29,77,A bike rider was hit by a goods tempo from behind . The bike rider applied sudden brakes whereas the tempo driver couldn't apply the brakes resulting in crash .,,,,,,,3918,2,East,Same Direction
12-09-2022,08:45 AM,210827,Ashwani,01-Jun-22,0827,166,18:30,30-10-2021,Backend Collision,TRUE,FALSE,FALSE,Fatal Crash,1,0,2,Unknown,,Burari Road Near Gali No 16,"Swaroop Nagar, Delhi",,29,77,A bike was hit by another bike causing injuries to the impacting bike rider and pillion .The bike rider later died due to injuries .,,,,,,,3919,2,West,Same Direction
12-09-2022,08:45 AM,210392,Ashwani,01-Jun-22,0392,168,12:15,13-10-2021,Hit Pedestrian,FALSE,FALSE,FALSE,Fatal Crash,1,0,1,Unknown,,"Opp. PNB BANK,","Devli Road Khanpur , Delhi",,29,77,A pedestrian was run over by a tractor the victim died in hospital during treatment.,,,,,,,3920,2,North West,Perpendicular Direction
12-09-2022,08:45 AM,210432,Ashwani,01-Jun-22,0432,168,09:30,05-11-2021,Hit Pedestrian,FALSE,FALSE,FALSE,Fatal Crash,1,0,1,Unknown,,"Near AK Motorcycle ,",Tigri Road,,29,77,A pedestrian was hit and run over by tractor .,,,,,,,3921,2,North East,Unknown
12-09-2022,08:45 AM,210012,Ashwani,01-Jun-22,0012,167,07:44,27-02-2021,Unknown,TRUE,FALSE,FALSE,Fatal Crash,1,0,2,Unknown,,"India GateCircle ,",National gallery of Modern Art.,,29,77,A bike rider was hit by unkown vehicle and was taken to hospital in CATS ambulance .,,,,,,,3922,1,South,Same Direction
12-09-2022,08:45 AM,210062,Ashwani,01-Jun-21,"0062
0062",167,11:40,13-04-2021,Unknown,TRUE,FALSE,FALSE,Fatal Crash,1,0,2,Unknown,,Zakir Hussain Marg,"India Gate , New Delhi",,29,77,A bike rider was hit by unknown vehicle .,,,,,,,3923,2,South,Unknown
12-09-2022,08:45 AM,210115,Ashwani,01-Jun-22,0115,167,00:16,26-08-2021,Hit Pedestrian,TRUE,FALSE,FALSE,Fatal Crash,1,0,1,Unknown,,"Ring Road Near CNG PUMP,","Pragati Power House,",New Delhi,29,77,"A pedestrian was hit by unknown vehicle , no other details available .",,,,,,,3924,2,East,Unknown
12-09-2022,08:45 AM,210125,Ashwani,01-Jun-22,0125,167,10:15,18-09-2021,Unknown,FALSE,FALSE,FALSE,Fatal Crash,1,0,2,Unknown,,"C Hexagon,","Near Pandara Road ,",New Delhi,29,77,A bike rider was hit by a goods tempo . Causing injury and death  of the bike rider .,,,,,,,3925,1,South,Unknown
12-09-2022,08:45 AM,210144,Ashwani,01-Jun-22,0144,167,05:50,29-10-2021,Unknown,TRUE,FALSE,FALSE,Fatal Crash,1,0,2,Unknown,,"Near BSES Office ,","Behind Hall no 11,","Pragati Maidan,New Delhi",29,77,A bike rider was hit by unknown vehicle and taken to hospital by public person was Declared DOA by doctor .,,,,,,,3926,1,North East,Unknown
12-09-2022,08:45 AM,210150,Ashwani,01-Jun-22,0150,167,06:17,07-11-2021,Hit Pedestrian,FALSE,FALSE,FALSE,Fatal Crash,1,0,1,Unknown,,Near UPSC,"Shahjahan Road , New Delhi",,29,77,A pedestrian was hit by a bike rider . The bike rider got her admitted in hospital .,,,,,,,3927,2,South,Perpendicular Direction
12-09-2022,08:45 AM,210157,Ashwani,01-Jun-22,0157,167,17:20,01-12-2022,Hit Pedestrian,FALSE,FALSE,FALSE,Fatal Crash,1,0,1,Unknown,,"W Point ,Tilak Marg",New Delhi,,29,77,A pedestrian was hit by a car .When the pedestrian was taken to hospital by PCR van was declared DOA .,,,,,,,3928,1,North,Unknown
12-09-2022,08:45 AM,210169,Ashwani,01-Jun-22,0169,167,19:00,23-12-2021,Single Vehicle Overturn,FALSE,FALSE,FALSE,Fatal Crash,1,0,1,Unknown,,"Near Gate no 7, Hyderabad House,","Ashoka Road , New Delhi",,29,77,An auto driver was injuried in a crash due to overturn of his vehicle . He was taken to hospital by CATS ambulance and was declared DOA .,,,,,,,3929,1,West,Not Applicable
