Auto_Date,Auto_Time,Form_No,Entry_Personnel,Filled_Date,FIR_No,Police_Station,Time_Of_Crash,Date_Of_Crash,Collision_Type,Hit_and_Run,Special_Case,Case File Available,Crash_Severity,No_Of_ Fatalities,No_Of_ Injured,No_Of_Vehicles,Location,Road_Type,Road_1,Road_2,Road_3,GPS_Lat,GPS_Long,Note,No_of_Lanes,Curb_Type,Shoulder_Type,Median_Type,Light_Condition,Weather_Condition,Crash_ID,Distance_From_Landmark,Text97,Veh_Rel_Travel_Dir
12-09-2022,08:45 AM,210284,Ashwani,20-May-22,0284,114,07:38,23-06-2021,Unknown,TRUE,FALSE,FALSE,Fatal Crash,2,0,2,Unknown,,Near Rajiv Gandhi Hospital,"Red Light Crossing , Sector -6",Rohini,29,77,"One Scooty was hit by car , injuring both Rider and pillion rider when taken to hospital both were declared DOA .",,,,,,,3763,1,,Unknown
12-09-2022,08:45 AM,210144,Ashwani,20-May-22,0144,162,20:45,21-04-2021,Unknown,TRUE,FALSE,FALSE,Fatal Crash,1,0,2,Unknown,,"Near Muthoot Finance,","Near Naharpur, Sector -3",Rohini,29,77,"One bike rider was hit by unknown vehicle , causing injury and death.",,,,,,,3764,2,North,Unknown
12-09-2022,08:45 AM,210384,Ashwani,20-May-22,0384,162,19:07,14-09-2021,Hit Pedestrian,TRUE,FALSE,FALSE,Fatal Crash,1,0,1,Unknown,,"Avantika Chowk,","Rohini , Delhi",,29,77,"A pedestrian was hit by unknown vehicle , no other details available of the crash .",,,,,,,3765,2,West,Unknown
12-09-2022,08:45 AM,210223,Ashwani,20-May-22,0223,140,20:05,01-05-2021,Unknown,TRUE,FALSE,FALSE,Fatal Crash,1,0,1,Unknown,,Near Pul Mithai Bus Stop,,,29,77,One pedestrian was hit by some unknown vehicle and no other details available.,,,,,,,3766,1,East,Unknown
12-09-2022,08:45 AM,210295,Ashwani,20-May-22,0295,162,17:45,21-05-2021,Backend Collision,FALSE,FALSE,FALSE,Fatal Crash,1,1,2,Unknown,,"Shop no 1 , Furniture shop","Sarai Phoos, Motiya Bagh Railway Colony","Tis Hazari , Delhi",29,77,One Manul Rickshaw was hit by a Cluster bus causing injury to puller and passenger .Later during treatment the puller died.,,,,,,,3767,1,South East,Same Direction
12-09-2022,08:45 AM,210210,Ashwani,20-May-22,0210,142,07:00,10-08-2021,Hit Pedestrian,TRUE,FALSE,FALSE,Fatal Crash,1,0,1,Unknown,,Near Shiv Sai Hanuman Mandir,Ring Road,,29,77,A pedestrian was hit by unknown vehicle and died .,,,,,,,3768,0,,Unknown
12-09-2022,08:45 AM,210235,Ashwani,20-May-22,0235,142,06:30,27-09-2021,Hit Pedestrian,TRUE,FALSE,FALSE,Fatal Crash,1,0,1,Unknown,,"Gate no6,",Safdarjung Hospital,New Delhi,29,77,A pedestrian was hit by unknown vehicle and died,,,,,,,3769,1,South,Unknown
12-09-2022,08:45 AM,210381,Ashwani,20-May-22,0381,142,22:19,28-12-2021,Unknown,TRUE,FALSE,FALSE,Fatal Crash,1,0,2,Unknown,,"Ring Road , Bhikaji Cama Flyover",Towards AIIMS,New Delhi,29,77,One cyclist was hit by unknown vehicle and died on the spot .,,,,,,,3770,2,West,Unknown
12-09-2022,08:45 AM,210080,Ashwani,20-May-22,0080,143,20:00,15-02-2021,Hit Pedestrian,TRUE,FALSE,FALSE,Fatal Crash,1,0,1,Unknown,,Near Nala Gas Chamber,"Vashisht Park , Sagarpur",,29,77,A pedestrian was hit by crane and died .,,,,,,,3771,1,South West,Same Direction
12-09-2022,08:45 AM,210035,Ashwani,20-May-22,0035,144,20:51,30-01-2021,Unknown,FALSE,FALSE,FALSE,Fatal Crash,1,1,2,Unknown,,"Sector 3, Pushp Vihar,","Near Army Camp, Asian",Market Road,29,77,A cycle and Motorcycle met with crash . The cyclist later succumed to his injuries .,,,,,,,3772,2,North,Unknown
12-09-2022,08:45 AM,210049,Ashwani,20-May-22,0049,144,00:50,13-02-2021,Hit Pedestrian,TRUE,FALSE,FALSE,Fatal Crash,1,0,1,Unknown,,"Lado sarai , New Delhi",,,29,77,A pedestrian was brought to hospital due to injuries from crash. No other details recorded in FIR,,,,,,,3773,2,South,Unknown
12-09-2022,08:45 AM,210070,Ashwani,23-May-22,0070,144,22:30,26-03-2021,Unknown,FALSE,FALSE,FALSE,Fatal Crash,1,2,2,Unknown,,Near Amity School,Pushp Vihar,Delhi,29,77,Two scootys crashed into each other causing injuries.,,,,,,,3774,2,,Unknown
12-09-2022,08:45 AM,210071,Ashwani,23-May-22,0071,144,15:30,27-03-2021,Backend Collision,TRUE,FALSE,FALSE,Fatal Crash,1,3,2,Unknown,,Near Saket Metro Station,Delhi,,29,77,"A bike was hit by a truck causing injuries to the biker rider , 02 pillion riders and death of third pillion rider .",,,,,,,3775,2,,Same Direction
12-09-2022,08:45 AM,210156,Ashwani,23-May-22,"0156
0156",144,03:50,02-06-2021,Single Vehicle Hit Fixed Object,FALSE,FALSE,FALSE,Fatal Crash,1,0,1,Unknown,,Seikh Sarai Red Light,Chirag Delhi Peer Baba,,29,77,One Scooty ride crashed his vehicle into a pole beside the road .,,,,,,,3776,2,East,Not Applicable
12-09-2022,08:45 AM,210241,Ashwani,23-May-22,0241,144,11:45,13-08-2021,Hit Pedestrian,TRUE,FALSE,FALSE,Fatal Crash,1,0,1,Unknown,,"Mandir Marg Near M Block,","Bus Stand ,New Delhi",,29,77,A young girl was hit by a SUV car. She was take n to hospital .,,,,,,,3777,1,South,Unknown
12-09-2022,08:45 AM,210248,Ashwani,23-May-22,0248,144,16:00,15-08-2021,Hit Pedestrian,TRUE,FALSE,FALSE,Fatal Crash,1,1,1,Unknown,,"MB Road,",Near Saket Metro Station,Saket,29,77,One DTC bus had hit 02 pedestrians on the road. Injuring both one of them later died due to injuries .,,,,,,,3778,2,South West,Unknown
12-09-2022,08:45 AM,210308,Ashwani,23-May-22,0308,144,00:00,24-10-2021,Hit Pedestrian,TRUE,FALSE,FALSE,Fatal Crash,2,0,1,Unknown,,Khokha Market,Monday Bazaar Road,,29,77,02 pedestrians were hit by unknown vehicle .,,,,,,,3779,0,,Unknown
12-09-2022,08:45 AM,210377,Ashwani,23-May-22,0377,144,05:00,29-05-2021,Unknown,FALSE,FALSE,FALSE,Fatal Crash,1,1,0,Unknown,,"In front of SDM office,",Near U Turn MB road,Meharuli Badarpur Road,29,77,One motorcyclist was hit by car . The impact caused injuries to the rider and death of pillion rider.,,,,,,,3780,0,,Unknown
12-09-2022,08:45 AM,210381,Ashwani,23-May-22,0381,144,23:11,26-12-2021,Unknown,TRUE,FALSE,FALSE,Fatal Crash,1,0,2,Unknown,,MB Road Near U-Turn,Saket,,29,77,One motorcycle rider was hit by unknown vehicle .,,,,,,,3781,2,South,Unknown
12-09-2022,08:45 AM,210110,Ashwani,23-May-22,0110,144,03:00,25-04-2021,Single Vehicle Run of the Road,FALSE,FALSE,FALSE,Fatal Crash,1,0,1,Unknown,,"Saket Court Red Light , Near MGF","Mall, Press Enclave Road ,",Saket Delhi,29,77,onr car slipped of the road killing the driver .,,,,,,,3782,1,,Not Applicable
12-09-2022,08:45 AM,210006,Ashwani,23-May-21,0006,145,22:20,03-01-2021,Hit Pedestrian,TRUE,FALSE,FALSE,Fatal Crash,1,0,1,Unknown,,"Towards Singhu Border ,",Under Loha Pul,,29,77,One pedestrian was hit by unknown vehicle . When taken to hospital by PCR was declared dead .,,,,,,,3783,4,North West,Unknown
12-09-2022,08:45 AM,210054,Ashwani,23-May-22,0054,145,23:28,31-01-2021,Hit Pedestrian,TRUE,FALSE,FALSE,Fatal Crash,1,0,1,Unknown,,Lower GTK Road,Near Nangli Poona Under Pass,,29,77,"A pedestrian was found unconscious and injured on road , when taken to hospital by CATS ambulance was declared dead .",,,,,,,3784,4,North West,Unknown
12-09-2022,08:45 AM,210145,Ashwani,23-May-22,0145,145,21:11,05-03-2021,Hit Pedestrian,TRUE,FALSE,FALSE,Fatal Crash,1,0,1,Unknown,,"GTK Road,","Near Gurudwara,",DelHi 42,29,77,A pedestrian was hit by unknown vehicle and taken to hospital by CATS ambulance .,,,,,,,3785,7,North East,Unknown
12-09-2022,08:45 AM,210247,Ashwani,23-May-22,0247,145,23:00,29-04-2021,Backend Collision,FALSE,FALSE,FALSE,Fatal Crash,1,1,2,Unknown,,"GT Karnal road,","Near Footover bridge ,","Libaspur , Delhi",29,77,One goods auto crashed into a truck from behind . The auto driver died due to injuries while under treatment in hospital .,,,,,,,3786,3,North West,Same Direction
12-09-2022,08:45 AM,210302,Ashwani,23-May-22,0302,145,18:17,19-02-2021,Hit Pedestrian,TRUE,FALSE,FALSE,Fatal Crash,1,0,1,Unknown,,Swaroop Nagar,Near Bus Stand,,29,77,A pedestrian was hit by unknown vehicle and was not in a state to give any statement.,,,,,,,3787,5,North West,Unknown
12-09-2022,08:45 AM,210357,Ashwani,23-May-22,0357,145,22:45,12-06-2021,Backend Collision,TRUE,FALSE,FALSE,Fatal Crash,1,1,2,Unknown,,Sanjay Gandhi Transport Nagar,Towards SBI Bank road,,29,77,One truck crashed into a scooty killing the rider and injurying the pillion .,,,,,,,3788,4,North West,Same Direction
12-09-2022,08:45 AM,210502,Ashwani,23-May-22,0502,145,23:00,15-07-2021,Hit Pedestrian,TRUE,FALSE,FALSE,Fatal Crash,1,0,1,Unknown,,"Upper GT Road,",Libaspur Underpass,,29,77,One pedestrian was injured on road and hit by unknown vehicle . He was brought to hospital by ambulance.,,,,,,,3789,3,North West,Unknown
12-09-2022,08:45 AM,210298,Ashwani,23-May-22,0298,145,20:00,23-05-2021,Single Vehicle Overturn,FALSE,FALSE,FALSE,Fatal Crash,1,0,1,Unknown,,Near Badli Metro Station,Samaipur,,28,77,"One scooty skid off the road as the driver and pillion were drunk , the rider applied brakes that led to skid.",,,,,,,3790,3,North west,Not Applicable
12-09-2022,08:45 AM,210002,Ashwani,23-May-22,0002,145,04:30,01-01-2021,Unknown,TRUE,FALSE,FALSE,Fatal Crash,1,0,2,Unknown,,A-7 Amazon Office,BIA  Delhi,,29,77,A motorcycle rider was hit by unknown vehicle. No details of offending vehicle were available .,,,,,,,3791,2,Nprth West,Unknown
12-09-2022,08:45 AM,210048,Ashwani,23-May-22,0048,145,23:15,28-01-2021,Unknown,TRUE,FALSE,FALSE,Fatal Crash,1,0,2,Unknown,,"Near LAL Path Lab ,","Sector 18, Rohini",,29,77,"One auto rickshaw was hit by unknown vehicle , causing injuries to the driver and later he died due to same in hospital .",,,,,,,3792,2,Nort West,Unknown
12-09-2022,08:45 AM,210121,Ashwani,23-May-22,0121,145,09:30,26-02-2021,Hit Pedestrian,TRUE,FALSE,FALSE,Fatal Crash,1,0,1,Unknown,,Siraspur Mor,"GTK ,Delhi",,29,77,A pedestrian was hit by unknown vehicle and injured . She was taken to hospital.,,,,,,,3793,7,North East,Unknown
12-09-2022,08:45 AM,210475,Ashwani,24-May-22,0475,145,16:00,10-07-2021,Hit Pedestrian,TRUE,FALSE,FALSE,Fatal Crash,1,0,1,Unknown,,"Near Police station,",SP Badli,,29,77,One pedestrian was brought to hospital by family in injured condition . No other details available in records.,,,,,,,3794,1,North West,Unknown
12-09-2022,08:45 AM,210773,Ashwani,24-May-22,0773,145,08:30,10-10-2021,Hit Pedestrian,FALSE,FALSE,FALSE,Fatal Crash,1,1,1,Unknown,,"Factory no S-44, Phase 1,",Badli Industrial Area,,29,77,One tempo driver had hit one pedestrian while reversing the vehicle and killed him on the spot and while driving off from site hit another pedestrian and injuring him also .,,,,,,,3795,3,north west,Opposite Direction
12-09-2022,08:45 AM,210779,Ashwani,24-May-22,0779,145,19:59,11-10-2021,Hit Pedestrian,TRUE,FALSE,FALSE,Fatal Crash,1,0,1,Unknown,,"Red Light ,Near Siraspur Gurudwara","Upper GTK road,",Delhi,29,77,A pedestrian was hit by unknown vehicle and was taken to hospital by public person and declared DOA,,,,,,,3796,3,North West,Unknown
12-09-2022,08:45 AM,210892,Ashwani,24-May-22,0892,145,21:42,30-11-2021,Hit Pedestrian,TRUE,FALSE,FALSE,Fatal Crash,1,0,1,Unknown,,GTK Bypass Near SGT Nagar,Red Light,,29,77,A pedestrian was hit by unknown vehicle and was taken to hospital by CATS ambulance. There he was declared DOA.,,,,,,,3797,4,north,Unknown
12-09-2022,08:45 AM,210929,Ashwani,24-May-22,0929,145,05:58,10-12-2021,Backend Collision,TRUE,FALSE,FALSE,Fatal Crash,1,0,1,Unknown,,"Lower GTK road,","Ashok Leyland ASCO,","Libaspur Metro Station , Delhi",29,77,"One motorcycle rammed into a moving truck ahead of them , as the truck driver applied brakes.",,,,,,,3798,2,,Same Direction
12-09-2022,08:45 AM,210150,Ashwani,24-May-22,0150,147,15:51,27-03-2021,Single Vehicle Overturn,FALSE,FALSE,FALSE,Fatal Crash,1,1,1,Unknown,,"Loop of Zakira Flyover ,","Towards Anand Parvat , Delhi",,29,77,One bike skid off the road and the rider and pillion rider fell of the bike and got injured . They were taken to hospital by PCR van .,,,,,,,3799,1,West,Not Applicable
12-09-2022,08:45 AM,210393,Ashwani,24-May-22,0393,147,20:50,24-06-2021,Hit Pedestrian,FALSE,FALSE,FALSE,Fatal Crash,1,4,1,Unknown,,"Kamal T point, New Rohtak Road,","Sarai Rohilla , Delhi",,29,77,One DTC Cluster bus hit a fixed police booth and injured pedestrians and killed one .,,,,,,,3800,1,South,Unknown
12-09-2022,08:45 AM,210484,Ashwani,24-May-22,0484,147,23:30,10-08-2021,Hit Pedestrian,FALSE,FALSE,FALSE,Fatal Crash,1,0,1,Unknown,,"Near Zakhira Flyover ,",Anand Parvat Industrial Area,"Sarai Rohilla , Delhi",29,77,one pedestrian was hit by a tempo and killed on the spot.,,,,,,,3801,1,South,Unknown
12-09-2022,08:45 AM,210596,Ashwani,24-May-22,0596,147,01:57,06-10-2021,Head on Collision,FALSE,FALSE,FALSE,Fatal Crash,2,0,2,Unknown,,"Swami Narayan Marg,","Near Chowki No -2, Sindhora Kalan",Delhi,29,77,A truck and scooty were involved in a crash .Killing the driver of the scooty on  the spot and pillion was also declared DOA when taken by PCR van.,,,,,,,3802,2,North,Opposite Direction
12-09-2022,08:45 AM,210016,Ashwani,24-May-22,0016,163,20:40,10-01-2021,Unknown,FALSE,FALSE,FALSE,Fatal Crash,1,0,2,Unknown,,Red Light near Jheel wala Park,"Road no 44, Lok Vihar Pitampura",Delhi,29,77,One cyclist was hit by truck and got injured when taken to hospital by PCR va was declared DOA .,,,,,,,3803,1,,Unknown
12-09-2022,08:45 AM,210031,Ashwani,24-May-22,0031,163,14:30,09-01-2021,Unknown,TRUE,FALSE,FALSE,Fatal Crash,1,0,2,Unknown,,"Red Light Prem Bari Pul,","Towards Azadpur ,",Delhi,29,77,A scooter rider was hit by unknown vehicle and taken to hospital for treatment .,,,,,,,3804,2,North East,Unknown
12-09-2022,08:45 AM,210090,Ashwani,24-May-22,0090,163,23:58,27-02-2021,Hit Pedestrian,TRUE,FALSE,FALSE,Fatal Crash,1,0,1,Unknown,,"Ring Road , Punjabi Bagh Footover",Opp. Shakurpur Metro Station,Delhi,29,77,"A pedestrian was hit by some unknown vehicle , he died on the spot .",,,,,,,3805,2,,Unknown
12-09-2022,08:45 AM,210552,Ashwani,24-May-22,0552,163,01:47,04-08-2021,Unknown,FALSE,FALSE,FALSE,Fatal Crash,1,1,2,Unknown,,"Prembari Flyover , Towards",Azadpur to Punjabi Bagh,,29,77,"One car and Bike rider crashed into each other , no details of crash were available .",,,,,,,3806,2,North,Unknown
12-09-2022,08:45 AM,210721,Ashwani,24-May-22,0721,163,21:17,16-09-2021,Hit Pedestrian,TRUE,FALSE,FALSE,Fatal Crash,1,0,1,Unknown,,"Britania Flyover ,",Punjabi Bagh towards Azadpur,,29,77,A pedestrian was hit by unknown vehicle and taken to hospital by CATS ambulance . There she was declared dead.,,,,,,,3807,2,South,Unknown
12-09-2022,08:45 AM,210397,Ashwani,24-May-22,0397,163,09:54,16-06-2021,Unknown,FALSE,FALSE,FALSE,Fatal Crash,1,0,2,Unknown,,Lala Jagat Narain Marg,Opp. Pitampura Bus Stop,"Distt. Park Sandesh Vihar ,Delhi",29,77,One scooty rider was hit by bus and the biker was taken to hospital by PCR where he was declared DOA .,,,,,,,3808,2,,Unknown
12-09-2022,08:45 AM,210790,Ashwani,24-May-22,0790,163,04:10,17-10-2021,Hit Pedestrian,TRUE,FALSE,FALSE,Fatal Crash,1,0,1,Unknown,,"Metro pillar no 347, Kohat Enclave","Near Red Light , Pitampura",Delhi,29,77,One pedestrian was found injured and taken to hospital by ambulance and was declared DOA.,,,,,,,3809,2,North,Unknown
12-09-2022,08:45 AM,210890,Ashwani,24-May-22,0890,163,00:00,27-11-2021,Unknown,TRUE,FALSE,FALSE,Fatal Crash,1,0,1,Unknown,,"Sri Nagar , Underpass",,,29,77,one pedestrian was hit by unknown vehicle and brought to hospital by auto .,,,,,,,3810,2,North West,Unknown
12-09-2022,08:45 AM,210988,Ashwani,24-May-22,0988,163,14:46,18-12-2021,Hit Pedestrian,TRUE,FALSE,FALSE,Fatal Crash,1,0,1,Unknown,,Below Kohat Metro Station,Main Road,,29,77,One pedestrian was found injured on road when taken to hospital by ambulance was declared dead.,,,,,,,3811,1,,Unknown
12-09-2022,08:45 AM,210167,Ashwani,24-May-22,0167,148,17:00,20-04-2021,Unknown,FALSE,FALSE,FALSE,Fatal Crash,1,0,2,Unknown,,"Under Sarita Vihar Flyover ,","Okhla Under pass , Sarita Vihar",,28,77,One Motorcyclist was hit by tempo and taken to hospital by PCR.,,,,,,,3812,1,South East,Unknown
12-09-2022,08:45 AM,210214,Ashwani,25-May-22,"0214
0214",148,01:07,24-05-2021,Unknown,FALSE,FALSE,FALSE,Fatal Crash,1,1,0,Unknown,,"Sarita vihar Flyover ,",Towards Badarpur (Mathura Road),Delhi,28,77,"A bike and scooty crashed on the flyover , injuring both the riders of the vehicles.",,,,,,,3813,1,South East,Unknown
12-09-2022,08:45 AM,210253,Ashwani,25-May-22,0253,148,03:45,07-07-2021,Sideswipe (Same Direction),FALSE,FALSE,FALSE,Fatal Crash,1,4,2,Unknown,,"Sarita Vihar Flyover ,",Mathura Road to Badarpur,,28,77,"One tractor had hit an  auto side ways and causing injuries to passengers of auto , killing one of them .",,,,,,,3814,1,South East,Same Direction
12-09-2022,08:45 AM,210321,Ashwani,25-May-22,0321,148,03:30,12-09-2021,Single Vehicle Hit Fixed Object,FALSE,FALSE,FALSE,Fatal Crash,1,0,1,Unknown,,"Road no 13 , K pocket","Near Park , Noida to Okhla side",,29,77,"A pillion car rider died due to crash , as the Car hit the divider .",,,,,,,3815,2,South East,Not Applicable
12-09-2022,08:45 AM,210286,Ashwani,25-May-22,0286,148,20:15,09-08-2021,Unknown,FALSE,FALSE,FALSE,Fatal Crash,1,1,2,Unknown,,"Near Sports Complex ,",Jasola Village Road,New Delhi,29,77,"A scooty and moped collided and caused injuries to both the drivers , when taken to hospital by autos onem of the rider was declared DOA .",,,,,,,3816,2,south West,Unknown
12-09-2022,08:45 AM,210403,Ashwani,25-May-22,0403,148,12:35,22-11-2021,Hit Pedestrian,FALSE,FALSE,FALSE,Fatal Crash,2,0,1,Unknown,,"Road no 13, Opp. Asia Pacific",Institute of Management U Turn,,29,77,A car hit 02 pedestrians while they were crossing road and injured them . When taken to gospital both were declared DOA .,,,,,,,3817,2,South East,Perpendicular Direction
12-09-2022,08:45 AM,210428,Ashwani,25-May-22,0428,148,22:20,08-12-2021,Hit Pedestrian,TRUE,FALSE,FALSE,Fatal Crash,1,0,1,Unknown,,"Gate No 2, K- Pocket ,",Sarita Vihar,New Delhi,29,77,A pedestrian was hit and killed by unknown vehicle on road .,,,,,,,3818,2,South East,Unknown
12-09-2022,08:45 AM,210068,Ashwani,25-May-22,0068,151,20:25,14-02-2021,Hit Pedestrian,TRUE,FALSE,FALSE,Fatal Crash,1,0,1,Unknown,,"Zero Pusta Road ,",Near Pandusheela Mandir,,29,77,"A pedestrian was hit by unknown vehicle and injured , he was taken to hopital by public person .",,,,,,,3819,1,South,Unknown
12-09-2022,08:45 AM,210218,Ashwani,25-May-22,0218,151,17:20,07-07-2021,Backend Collision,FALSE,FALSE,FALSE,Fatal Crash,1,0,2,Unknown,,"Seelampur Flyover , Opp.",Gurudwara,,29,77,A motorcyclist was hit by a bus and got injured . When taken to hospital was declared DOA.,,,,,,,3820,0,South,Same Direction
12-09-2022,08:45 AM,210293,Ashwani,25-May-22,0293,151,02:30,23-08-2021,Hit Pedestrian,TRUE,FALSE,FALSE,Fatal Crash,1,0,1,Unknown,,"66 Foota Road , near Nala,","Seelampur , Delhi",,29,77,A pedestrian was hit by unknown vehicle and died on the spot .,,,,,,,3821,0,East,Unknown
12-09-2022,08:45 AM,210351,Ashwani,25-May-22,0351,151,22:02,24-09-2021,Hit Pedestrian,TRUE,FALSE,FALSE,Unknown,1,0,1,Unknown,,"Ghas Mandi Crossing,","66 Foota Road,","New Seelampur , Delhi",29,77,A pedestrian was found injured on road side and was taken to hospital by PCR van .The doctor declared him DOA .,,,,,,,3822,0,East,Unknown
12-09-2022,08:45 AM,210076,Ashwani,25-May-22,0076,152,23:00,19-02-2021,Unknown,FALSE,FALSE,FALSE,Fatal Crash,1,0,2,Unknown,,"Near MCD Toll Tax ,",Opp. Dilshad Garden Flyover,Delhi,29,77,A scooty rider was hit by truck . The injured rider was taken to hospital by  CATS ambulance.,,,,,,,3823,1,South,Unknown
12-09-2022,08:45 AM,210196,Ashwani,25-May-22,0196,152,17:30,17-04-2021,Hit Pedestrian,TRUE,FALSE,FALSE,Fatal Crash,1,0,1,Unknown,,"Seemapuri Roundabout ,",Delhi,,29,77,A pedestrian was hit by unknown vehicle and later died in hospital due to injuries .,,,,,,,3824,2,North East,Unknown
12-09-2022,08:45 AM,210207,Ashwani,25-May-22,0207,152,06:15,01-05-2021,Hit Pedestrian,TRUE,FALSE,FALSE,Fatal Crash,1,0,1,Unknown,,"Seemapuri Roundabout ,","Near Shamshan Ghat ,Delhi",,29,77,A pedestrian was hit by unknown vehicle .,,,,,,,3825,2,North East,Unknown
12-09-2022,08:45 AM,210211,Ashwani,25-May-22,0211,152,01:30,03-05-2021,Unknown,TRUE,FALSE,FALSE,Fatal Crash,1,0,2,Unknown,,"Guru Nanak Rasoi ,","Hari Wardi wala School,",Dilshad Garden Delhi,29,77,"An auto was hit by unknown truck , causing injuries to auto driver",,,,,,,3826,2,North East,Unknown
12-09-2022,08:45 AM,210257,Ashwani,25-May-22,0257,152,21:24,03-06-2021,Hit Pedestrian,TRUE,FALSE,FALSE,Fatal Crash,1,0,1,Unknown,,"Near J&K Pocket , Gate No 2",Delhi,,29,77,A pedestrian was hit by unknown vehicle and taken to hospital by public person.,,,,,,,3827,1,North East,Unknown
12-09-2022,08:45 AM,210553,Ashwani,25-May-22,0553,152,23:10,21-09-2021,Hit Pedestrian,TRUE,FALSE,FALSE,Fatal Crash,1,0,1,Unknown,,Near Seemapuri DTC Bus,"Depot, Delhi",,29,77,A pedestrian was hit by unknown vehicle .,,,,,,,3828,2,North,Unknown
12-09-2022,08:45 AM,210661,Ashwani,25-May-22,0661,152,09:30,22-10-2021,Hit Pedestrian,TRUE,FALSE,FALSE,Fatal Crash,1,0,1,Unknown,,Seemapuri Roundabout,Delhi,,29,77,A pedestrian was hit by unknown vehicle .,,,,,,,3829,2,North East,Unknown
12-09-2022,08:45 AM,210715,Ashwani,25-May-22,0715,152,07:15,10-11-2021,Hit Pedestrian,FALSE,FALSE,FALSE,Fatal Crash,1,0,1,Unknown,,"Cluster no 6, Dilshad Garden Depot ,","Seemapuri , Delhi",,29,77,A pedestrian was hit by bus and the rear wheels of the bus ran over him . Killing the person on the spot.,,,,,,,3830,2,North East,Opposite Direction
12-09-2022,08:45 AM,210772,Ashwani,25-May-22,0772,152,23:00,08-09-2021,Hit Pedestrian,TRUE,FALSE,FALSE,Fatal Crash,1,0,1,Unknown,,Suraksha Nursing Home,Delhi,,29,77,"A pedestrian was hit by a car , sideways causing internal injuries to the victim . He died in hospital while under treatment.",,,,,,,3831,2,North East,Opposite Direction
12-09-2022,08:45 AM,210067,Ashwani,25-May-22,0067,153,22:20,21-02-2021,Unknown,TRUE,FALSE,FALSE,Fatal Crash,1,0,2,Unknown,,"Water Box , Strret light no 868,","Near Badli Nahar ,",Delhi,29,77,A motorcyclist was hit by unknown vehicle the injuries led to his death .,,,,,,,3832,4,North,Unknown
12-09-2022,08:45 AM,210123,Ashwani,25-May-22,0123,153,15:30,21-03-2021,Unknown,TRUE,FALSE,FALSE,Fatal Crash,1,1,2,Unknown,,"Road Sec-34 Rohini,","Towards Sec-29 Rohini ,","Near Khera Nahar , Delhi",29,77,A motorcycle was hit by unknown vehicle injuring both the rider and the pillion rider.,,,,,,,3833,4,North West,Unknown
12-09-2022,08:45 AM,210326,Ashwani,26-May-22,0326,153,21:30,25-06-2021,Unknown,TRUE,FALSE,FALSE,Fatal Crash,1,0,2,Unknown,,"Sec-5, Bawana Road,",Near Barwala Red Light,Delhi,29,77,A motorcyclist was hit by a tempo . The bike rider died .,,,,,,,3834,2,North West,Unknown
12-09-2022,08:45 AM,210369,Ashwani,26-May-22,0369,153,20:33,12-07-2021,Unknown,TRUE,FALSE,FALSE,Fatal Crash,1,0,2,Unknown,,Mahadev Chowk Khera NaharRoad,"Near Power house ,","Sec-29 , Rohini Delhi",29,77,"A ccyclist was hit and injured by a car , when taken to hospital by CATS ambulance was declared DOA.",,,,,,,3835,2,North East,Unknown
12-09-2022,08:45 AM,210386,Ashwani,26-May-22,0386,153,12:35,20-07-2021,Unknown,TRUE,FALSE,FALSE,Fatal Crash,1,0,2,Unknown,,"Near Khera Village , Nahar T Point,","Sec-28-29 Rohini Divider Road ,",Delhi,29,77,"A motorcyclist was hit by a tempo, the impact caused fatal injuries to the rider.",,,,,,,3836,2,North,Unknown
12-09-2022,08:45 AM,210496,Ashwani,26-May-22,0496,153,07:32,30-08-2021,Hit Pedestrian,TRUE,FALSE,FALSE,Fatal Crash,1,0,1,Unknown,,"Gali No 10 , Near","Vikram Dharam Kanta , Village","Shahbad Daulatpaur , Delhi",29,77,One pedestrian was hit and killed by truck on the spot .,,,,,,,3837,4,,Unknown
12-09-2022,08:45 AM,210540,Ashwani,26-May-22,0540,153,10:00,20-09-2021,Hit Pedestrian,FALSE,FALSE,FALSE,Fatal Crash,1,0,1,Unknown,,Jain Colony Gali no 3,"Barwala , Delhi",,29,77,A pedestrian was hit by tractor trolly while tractor driver was reversing the vehicle . The rear tyre ran over the victim.,,,,,,,3838,3,,Opposite Direction
12-09-2022,08:45 AM,210022,Ashwani,26-May-22,0022,153,19:55,14-01-2021,Unknown,TRUE,FALSE,FALSE,Fatal Crash,1,0,2,Unknown,,"Near NDMC Apartment ,","Sec-11 , Rohini",Delhi,29,77,A scooty rider was hit by unknown vehicle when taken to hospital was declared dead .,,,,,,,3839,5,East,Unknown
12-09-2022,08:45 AM,210585,Ashwani,26-May-22,0585,153,18:30,08-10-2021,Unknown,TRUE,FALSE,FALSE,Fatal Crash,1,0,2,Unknown,,"Near CNG Pump ,","Sec-29 , Rohini,",Delhi,29,77,A motorcyclist was hit by unknown vehicle and killed .,,,,,,,3840,3,,Unknown
12-09-2022,08:45 AM,210646,Ashwani,26-May-22,"0646
0646",153,02:00,05-11-2021,Unknown,TRUE,FALSE,FALSE,Fatal Crash,1,0,2,Unknown,,Red Light Near Japanese PARK,"Sec-11 Rohini , Delhi",,29,77,A motor cyclist was hit by unknown vehicle and was declared DOA in hospital.,,,,,,,3841,3,East,Unknown
12-09-2022,08:45 AM,210159,Ashwani,26-May-22,0159,154,00:00,15-06-2021,Hit Pedestrian,TRUE,FALSE,FALSE,Fatal Crash,1,0,1,Unknown,,"Near Vikas Mall ,",GT Road Shahdara,Delhi,29,77,A pedestrian was hit by unknown vehicle and was taken to hospital by ambulance .,,,,,,,3842,0,East,Unknown
12-09-2022,08:45 AM,210322,Ashwani,26-May-22,0322,154,04:00,02-10-2021,Hit Pedestrian,FALSE,FALSE,FALSE,Fatal Crash,1,0,1,Unknown,,"GT Road , Near Maha MayaMandir,","Sabzi Mandi, Shahdara",Delhi,29,77,A pedestrian was hit by a car and died in hospital during treatment.,,,,,,,3843,0,,Unknown
12-09-2022,08:45 AM,210396,Ashwani,26-May-22,0396,154,10:30,01-12-2021,Single Vehicle Run of the Road,FALSE,FALSE,FALSE,Fatal Crash,1,0,1,Unknown,,"Near H.no- 1/6205, Gali no 2","East Rohtash Nagar,","Shahdara, Delhi",29,77,A pillion rider fell of the scooty due to application of emergency brakes and got injured .,,,,,,,3844,1,,Not Applicable
12-09-2022,08:45 AM,210212,Ashwani,26-May-22,0212,155,22:00,22-06-2021,Backend Collision,FALSE,FALSE,FALSE,Fatal Crash,1,0,2,Unknown,,"Near Shahji Dairy ,","Road No 13,",Shaheen Bagh,29,77,A motorcyclist was hit by a truck and ran over him and injuring .,,,,,,,3845,2,East,Same Direction
